,title,score,id,url,comms_num,created,body,ups
77,Forgiving yourself for past mistakes??,7,ogz5sm,https://www.reddit.com/r/NPD/comments/ogz5sm/forgiving_yourself_for_past_mistakes/,7,1625848090.0,"Something I am struggling with, reading up on NPD and relating to everything and looking back at situations where I was completely unaware of this and the shame that follows. 
Do you ever look back to your childhood/teenage years and see unfiltered NPD behaviours? 
It feels like I have changed a lot of these, since growing up, (I am 22) but I think ultimately, is that who I really am? Is that the pure truth of me? I have learned to control my anger/rage, I don’t verbally attack anymore, I don’t show jealousy or envy as I did, but underneath I feel it’s still there , I have just gotten better at either hiding or managing it. Or do I not allow myself to feel as strongly towards others where this behaviour can come out. 
This new awareness is fresh and I am allowing myself to feel the shame of who I have been. Does this ease with time? I’m not sure if I feel genuine guilt, or if I’m ashamed that my behaviours could easily be analysed and people will see me.  
I really have tried to be ‘normal’ but my brain just feels distorted.",7
78,Getting treatmeant for Narcissism,13,nx9icy,https://www.reddit.com/r/NPD/comments/nx9icy/getting_treatmeant_for_narcissism/,11,1623394152.0,"Which kind of therapy, is there a way to talk about Narcissitic/NPD traits to a therapist without ending up getting diagnosed, any there any self-help sources? (When i try to look up help its all only for people around the narcissist and not for the narcissitic person)? 
My main problems are:

I dont really care if i hurt other people unless i have chosen that person as my equal/an extension of me then i really care

I do think its fun to make people upset/angry/sad but only if i dont like them/are neutral about them. I especially want them to hurt if they did something harmfull to me or one of the people i care about (mainly because thats an attack on me aswell)

I dont feel like i have a real personality, i only have an intense need for validation, praise, love and recognition

When someone annoys me i want to hurt them, i usually do this by changing my tone to make it clear that I dont like them, i usually want to do violent stuff aswell but i can hold myself back

I lie a lot, and its very hard for me to stop even when i try

As soon as a person (even one i did care about) is out if my life/is not really any use for me. I completely stop caring, cut the connection and find someone else

I get extremely depressed, like actively considering to kms, when i dont have people around me to think i am great, it only takes 3 days without people actively admirering me before i get to this state

I believe i dersevere better than other people and that i am better, this leads to a lot of disappointment and anger when people around me dont recognize it.

I try to manipulate sometimes, but I am bad with social cues and often fail and just anger people or upset them

When i dont want people to be upset or anger them or hurt them i often acidentally do

I get extremely jealous of others, especially if they are getting recognition for something i should be getting it for instead. I get very angry with the person who got the recognition instead of me.

I will choose an authority figure who i believe is superior in some way and really try and make them like me, I will plan stuff around making them notice me and think i am special. When i realize they are just a person who isnt special i completely loose interest

I feel like i am the most worthless horrible person in the world, i feel like i am just like my dad who violently (emotionally and physically) abused me because he had similar traits

I dont really feel any emotions exept rage and anger or intense emptyness or sometimes satisfaction when i get recogntion.

I feel no remorse when i do something to hurt other people that didnt hurt me, sometimes (often) i even find it kind of funny

When people get upset with me or are upset around me i usually dont feel bad and i dont know how to react to them or make them okay, my go to is just kind of laughing ackwardly, or i will go full empath mode, exept i dont care about them i just pretend i really do, when i do that i feel better about myself for being a good person and i will think about it for a long time and make it a really big deal i did that for them. I dont expect anything in return, except they should think i am a good person aswell.

I really dont function in social situations, i am very ackward and introverted and i find it very hard to communicate with people and just have fun with them(might be more autism related)

I dont want to talk to people unless there is some kind of endgoal with it, usually my goal will be recognition, higher social status, or in general me obtaining something.

When i am with a group of people i feel superior too and i havd higher status than i will exploit that to put them down and have fun with saying incredebly rude and devaluing things, though if i believe it will start to have a consequense for me i will stop.

I do have a compass of what is right and wrong, but i am also very aware that i can just disregard it if i want to with no consequences and it is very tempting for me at times, but i feel superior if i dont do morally wrong things (this is mostly through the lense of social justice) its not that i dont care about the people, and if i am advocating for a minority, especially one i am a part of I do mean it, but a lot of that probably cones from me builiding my personality on being morally superior

I cant take critisicm, it makes me feel completely worthless and very angry/upset.

If i am hurting someone i dont really want to hurt, but they are disagreeing with me and i want to make my point, it doesnt really bother me that they got very upset, i do feel remorse if it hurt me indirectly (like my other friends being mad at me) but me making my point matters more to me than them not being upset

I dont really believe any of the relationships i have had that failed have been my fault, but i am starting to question it after learning about personality disorders.

I also have sone traits of narcissim that just dont really bother me so i havent listed them here, but the ones i have listed i feel like are making me hurt others which i do know is bad even if i dont care that much, but it will also hurt me in the end. I would like to feel empathy, i did when i was younger (like 3-4) at least i think but i am not sure. I mainly remeber traumatic stuff from before i was 12. I think people who dont feel like this are a lot happier and live better lifes.

I am currently trying to get an autism diagnosis because of other stuff but also because of some of these traits, i am 17 rn so that might make it easier for me to just talk to a therapist about these things without getting a diagnosis for a personality disorder? Also autism (especially aspergers) treatmeant does focus on not hurting other people and fitting in, at least i think so? But i dont know if that will fix the underlying problem. Also im not trying to claim i have a personality disorder as i am 17 and just have not done wnpugh research on all the traits of one, but i really do struggle with these things and i want to get better and i dont know how.

Sorry for spelling mistakes and for being rambly",13
79,Trust,6,odxgne,https://www.reddit.com/r/NPD/comments/odxgne/trust/,7,1625449577.0,"Before I go any further I want to say that I am a teenager and self-diagnosed, so that might affect the answer to my struggles.

So today, long story short (well, kind of short), I was playing video games with someone and they and another person wanted to talk in private after a match where I did an accident and told my teammate I was trying to lose (I wasn't), so my paranoid ass (especially because we were losing) felt as if a few of my teammates I was playing with were against me in some way - I already feel like if I reveal my true self (or what I call my true self), people would turn against me -; I was angry, did things, may have lost a friend (which may not be a bad thing).

My question is, in a situation like that, how do I react in a better way than anger? And how do I get to a 'normal' level of trust with people?",6
80,Let's be honest,6,lpv7ck,https://www.reddit.com/r/NPD/comments/lpv7ck/lets_be_honest/,15,1614016997.0,"Okay so when I'm truly honest with myself, I at least have narcissistic traits. 

I have a couple questions though 

1. Can we born with this? As my personality and behavior I believe I have ALWAYS had. 

2. I WANT to empathize with people, I understand they have their own feelings but I can't really fathom them to understand. 

Background, I used to manipulate people to get what I wanted. In small ways I think, or I'd let things slide or ignore things to protect myself. 
I always wanted to be the prettiest, and actually believed I was pretty up there. Loved being wanted. 
There's more examples but I can't be bothered or recollect them right now.",6
81,How would you describe covert narcissism?,8,lacsu8,https://www.reddit.com/r/NPD/comments/lacsu8/how_would_you_describe_covert_narcissism/,17,1612210352.0,"To someone who is neurotypical.. I am quite new to all of this and I can really understand it reading other people's posts but I'm not sure how I'd explain it myself to someone, especially to someone who can't even really relate to depression. Thoughts?

Layman's terms, basically.

Edit: I am now realising how many types there are😂 I might not even be covert. Thanks for all the info though everyone!",8
82,i hate rules and have anger issues.,4,8n6dad,https://www.reddit.com/r/NPD/comments/8n6dad/i_hate_rules_and_have_anger_issues/,6,1527661689.0,"i can't be dealt with due to my anger issues, even on reddit when i am told by a mod that i have broken a rule i immediately get on the defense and want to attack the mod with vulgar words. i feel how dare my posts be removed or even taken down, i demand the entitlement to have my post seen by others. talking with me is hard because i will likely get defensive and verbally go off the rails. i don't feel special but i do think i deserve to post whatever i want and for it to not be taken down  ",4
83,I'm terrified that I'm a covert narcissist,45,n7oa6q,https://www.reddit.com/r/NPD/comments/n7oa6q/im_terrified_that_im_a_covert_narcissist/,12,1620477166.0,"Here me out before you say ""if you're even wondering at all if you're a narcissist, you aren't one"".

Any emotions I feel all relate to my self-centeredness. I fit all the criteria of covert narcissists but fluctuate thinking I'm strongly intelligent and confident and hating myself altogether. When I considered the possibility that I am a narcissist, I felt regret. But the regret was in how many people I had been rejected by socially or driven off, for reasons that I'm becoming more self-aware of.

When it comes to friends, I can be callous, cruel, and easily offended. Some of our friend group conflicts were started by me perceiving slight in something someone said. Usually I'm not truly sorry. I'm only sorry because it caused people that I do fun activities with to temporarily shun me. I also hold grudges with an immense anger for longer than people think is normal. 

I have guilt. But the guilt I have for treating people this way is because I'm rating my worthiness as a person by how many non-broken bonds I have. At the time, I feel shame but then end up not caring what these people who have rejected me think.

I enjoy helping people. Though I'll feel pity for someone, I don't visualize/feel their situation without some hard effort.

What else? I was very entitled as a toddler and young child apparently. I feel guilt, but it's all about how it relates to me and how people see me. So I don't consider it genuine. I'm quite worried if I am a narcissist. If diagnosed, I think it would mean that narcissism is genetic in my family. I'd be worried for my kids feeling this way, constant subconscious shame.

Reddit, does this sound like covert narcissism?",45
84,I feel so angry.,6,odq1lx,https://www.reddit.com/r/NPD/comments/odq1lx/i_feel_so_angry/,5,1625422961.0,"Am I supposed to yell when I actually get angry, ice always been too ashamed of my anger for the last decade.",6
85,Could I have been misdiagnosed?,13,np8gqy,https://www.reddit.com/r/NPD/comments/np8gqy/could_i_have_been_misdiagnosed/,10,1622481597.0," 

I got the diagnosis of major depression at the age of 13. From then on I was the girl who must have low self esteem, who felt pressure to cut herself and who apparently wanted to die.

Let me start at my childhood. I was born in a somewhat wealthy family. When I was 2 my younger sister was born. I didn't like that. Growing up I would often hit her and intimidated her. One time I pooped in her bed and she got blamed for it. She was scared of me especially of my anger outbursts. Besides that we've played together a lot. In kindergarten I remember eating a piece of a birthday cake that was reserved for someone else. Of course I didn't admit to it but a different kid did even though he had nothing to do with it whatsoever. I like I wasn't blamed. However I often had stomach pain before going to kindergarten each day and often did not want to go. My mother says it was due to being anxious. In primary school I remember crying one time while giving a presentation.

My parents decided to get pets. So we had a dog who I loved. Despite that I would often beat her. I guess I took agression my father gave me out on her. He was prone to outbursts, shouting and slapping me. My mother did not like that but ended up denying it when I told the psyadric staff years later. Meanwhile my parents had a failing marriage. We also had two guinea pigs. I remember putting both of them into a tiny suitcase and throwing them down the stairs when I randomly got very angry. Upon impact the suitcases opened and the two of them were fine. You could say I abused my pets I would say. On the topic of that, I killed a pet snake after she escaped because I couldn't find her anymore and simply refused her water. I also got rats which I later released in the wild because my family was not happy with them. I don't regret what I did. In fact I have not felt guilt in my life ever. This is the main reason I believe I don't fit the criteria for depression. I don't think people know about this anyway so that could explain why I got depression and not something else. I think I got put into a box without looking deeper into my mind.

In fifth class I was more of a loner. My grades were okay but got worse over time. I then had to repeat seventh grade. I had a small circle of friends.

One day I remember a classmate opening a pencil sharpener and talking to other people how they could be hurtful to someone. That day I went home, opened mine and drew about four thin cuts on my arms. This lead to what I believe was more of an addiction. I had to hurt myself to feel better. By the way, I was never asked why I started it. People kept talking about some pressure which had to be released which apparently I did through cutting. I don't remember there being such a pressure. I just did it sometimes. Then my parents took me to a psychriatic hospital and I was interviewed.

So I got diagnosed with depression because:

\- I felt little emotion. Like a cloud was over them. Now (at the age of 22) I feel neutral most of the time.

\- I'd hurt myself

\- I did feel sad and cried often during my following teenage years. I also continued cutting myself.

\- My selfharm and frequent crying (main reason someone gets diagnosed with depression) just stopped apruptly. But I never received the therapy a person with depression and selfharm would need.

Another thing that surprises me that I had no problem with dressing heavily in alternative clothing, hairstyles and make up, I was also anxious and got a diagnosis for social anxiety. If people with anxiety care so much about how others view them, why would I dress in a way that says ""weirdo"" to begin with? At one point I got diagnosed with psychotic depression but that seems like a weak explanation at best.

The reason people believe I was depressed was that a lot of things happened at the same time. My parents split up, my beloved dog died (I never said goodbye or anything) and my ex was a douchebag. However this explanation does not resonate with me much and I just roll with it and the image of the struggling depressed kid who is now recovered.

I went through an emotionally abusive relationship during middle school. After about 9 months I was out of it and me and my best friend at the time both agreed he was a psychopath based on evidence but that is not relevant now.

Funnily enough though, one therapist I saw I showed potential signs of developing a personality disorder. The three ones that stood out mostly were schizoid, narcissistic and maybe antisocial and borderline. I now have the diagnosis that basically says you will sure have one in the future (my father is borderline). Still I have the diagnosis of depression and this other thing that is a lighter version of depression (can't remember the name).

I could ""become"" schizo according to her because I don't go out often even though I now have a boyfriend and we see each other frequently. He is an ideal marriage partner. I also would like to make friends however the ones I make are temporary and I am not regarded as a friend back? I have though about the possibilities of having autism as well, but I don't match the criteria in other aspects.

Realizing this made me remember I am surely going to have a personality disorder however it seems that looking over the diagnostic criteria of the ones I've mentioned don't seem to fit someone who was depressed. And I am certainly I am not depressed now.

Keep in mind I don't fit the criteria for any of the personality disorders mentioned (yet =)). I also don't think I ever fitted the diagnostic criteria for depression to begin with.

According to psymed this is a list of some criteria for a diagnosis and my experiences with them:

* Depressed mood most of the day, nearly every day. (Not true now, but mostly true then.)
* Markedly diminished interest or pleasure in all, or almost all, activities most of the day, nearly every day. (Low yes, but not ""diminished"")
* Significant weight loss when not dieting or weight gain, or decrease or increase in appetite nearly every day. (Never true)
* A slowing down of thought and a reduction of physical movement (observable by others, not merely subjective feelings of restlessness or being slowed down). (Never true)
* Fatigue or loss of energy nearly every day. (Sometimes true then and now)
* Feelings of worthlessness or excessive or inappropriate guilt nearly every day. (I did feel worthless in the past sometimes. Not true today at all. Also I have never experienced guilt in my life, ever.)
* Diminished ability to think or concentrate, or indecisiveness, nearly every day. (Never true)
* Recurrent thoughts of death, recurrent sudicidal imagination without a specific plan, or a suicide attempt or a specific plan for committing suicide. (Never true. However I once told my abusive ex I tried to kill myself so he would care about me. That did not work as I later realized he never cared anyway)

I can see this is a lot for some of you to go through and I am looking forward to your feedback! Thank you to those who read all. Please let me know what you think. Who would know better than you?",13
86,"I’m a narc who loathes other narcs. That said, I have respect for smart, successful people whether they’re narcs or not. The people I loathe most are narcs w/ABSOLUTELY zero reason whatsoever to be respected. No special skills. No accomplishments. Those people I hate w a passion.",46,mdmszt,https://www.reddit.com/r/NPD/comments/mdmszt/im_a_narc_who_loathes_other_narcs_that_said_i/,31,1616759245.0,"I’m thinking of a so called friend. This guy is a stupid SoB who thinks he’s a real big shot. And he’ll explode in anger and start name calling if you ask him anything he perceived as undermining his nonexistent credibility.   Anyway I hate that m fer and have actually started secretly recording him bad mouthing his fiance, friends and coworkers because I’m building up loads of incriminating compromat to ruin all of his relationships including ruin his wedding by giving his soon to be wife my nice audio collection of him bad mouthing her and her family. No. I’m not joking. Sucks to be him. Takes a narc to shut a narc down.",46
87,I think I'm a covert narcissist and I hate myself for it,7,m5uf99,https://www.reddit.com/r/NPD/comments/m5uf99/i_think_im_a_covert_narcissist_and_i_hate_myself/,4,1615841109.0,"I'm 36 years old. I have bad rage.

I have a lot of anger issues especially relating to when people tell me no. I've driven away almost every single person in my life. 

I Target one particular person in particular with my rage. When I am unable to make this person do as I want I will yell and scream and blow up and harass them with phone calls.

I have made threats of racial slurs. I have treated them with violence.

it pains me greatly to think of myself as a narcissist because I have a lot of black and white thinking and think that narcissists are bad people.

I'm a bad person who is very depressed. I seek out pity and attention constantly.

I really struggle with empathizing with people.

What do I do?",7
