,title,score,id,url,comms_num,created,body,ups
188,Do I have NPD?,8,cu19n3,https://www.reddit.com/r/NPD/comments/cu19n3/do_i_have_npd/,12,1566497569.0,"First, for some background/context: I'm a late-20s gay male from the US.

Since I was young, I've always loved and needed attention. As a young child, I was unusually precocious and outgoing with adults and would go up and talk to random strangers. I was a favorite of a couple of teachers and I believe I was complimented a lot about how smart, charming, and cute I was.

I've always DESPISED being ignored and/or invisible. As a kid, if someone ignored me, I'd literally pester them until they responded. And now, if someone doesn't respond to my text in a short amount of time, I'll get huffy, even texting them multiple times to pester them, sometimes angrily.

Since I was at least \~ 12-13, I've also always felt this deep-seated need to be perfect and since I'm not, I'm constantly at war with myself and with the world, because it doesn't recognize my ""perfection."" This need for perfection feels like it's coming from some internal parent-like force. If I'm not perfect, my superego tells me that I'm worthless, unlovable, and thus I hate myself. I can only ""refuel"" the feeling of perfection by getting attention and admiration by strangers, which my mind then conveniently warps and twists to fit that image of perfection. (Sam Vaknin's articles on this really resonate with me.)

As a teenager, I had virtually no real-world social life whatsoever for about 4-6 years. My substitute was spending copious and excessive amounts of time on Internet forums for various topics, trying to seem like the smartest person there, getting frustrated and even enraged when I wasn't. I eventually grew to be universally hated on one forum because of my know-it-all and confrontational attitude.

And when my friend told me his IQ was higher than mine at 19, I went into what I feel was a narcissistic rage. I was so uncontrollably angry. But I guess I mostly got over it, at least enough to still had fun on the vacation we went on together.

And therein lies the rub. That need for attention for my intellect have mutated into this insatiable need for attention for my looks, since I've realized I'm good looking in the past 8 years.

I walk down the street of the busy city I live in, expecting attention and getting angry when heads don't turn on the sidewalk. At some level, I realize I'm not a super model. I would peg myself at about a 8.5/10 face-wise (maybe less if you count my acne). I think that's realistic as I am very good looking, but not gorgeous or a movie star.

And that angers, upsets, disappoints, and, hell, panics me to no end, because it means I've FAILED at perfection.

I'll never get the level of attention and admiration as that kind of person. And when I see someone more attractive than me, I often fly into a narcissistic rage.

When I look at myself in the mirror, I'm usually disappointed, continuing to compare myself to the likes of George Clooney, Brad Pitt, and others and inevitably falling short.

I also constantly self-sabotage. I have a business that I could have grown into something fairly big, but instead I'm still a one-man band and am in a lot of debt and can barely afford to live. I just ""skate by"" and am a classic ""failure to launch.""

Finally, I've never ejaculated with another human being, so perhaps I'm technically a virgin, at almost 30, and that's also incredibly depressing. I have severe ED whenever I try to hook up, because I'm so afraid of intimacy/people/judgment.

**So, to sum up, and some other traits:**

\- An insatiable need for attaining perfection and worthlessness when I inevitably don't feel and am not perfect

\- An insatiable need for attention and admiration in public as a reminder that I'm ""beautiful"" and fulfill my delusional fantasy of perfection

\- Defective/nonexistent romantic relationships and sex life. I live in my fantasy world of what could be, refusing and being too scared to disrupt or shatter my fantasy of perfection by actually risking real-world appraisals of my looks and worthiness and the associated rejection

\- Narcissistic rage when I'm told I'm not as handsome (in particular), smart, etc. as I wish I were

\- Constant self-sabotage, not attaining anywhere near my potential, doing things that intentionally and sadistically jeopardize myself--e.g. not going to events that could get me more clients, saying mean, rude, or poorly worded things or giving off bad energy to potential romantic prospects...countless more examples

\-----

Do I have NPD?

Thank you for reading this long wall of text.",8
189,Therapist Thinks I'm Not A Narc.,11,bdmvig,https://www.reddit.com/r/NPD/comments/bdmvig/therapist_thinks_im_not_a_narc/,21,1555371041.0,"My therapist is adamant that I'm not a narcissist.  But I can't accept the diagnosis.  I feel that even if I wanted to be honest with him, or with anyone, about who I am and what I want and *why* I want, I couldn't do it.  Because I don't know who I am.  

I've been watching videos of me as a kid and its plain as day that my dad couldn't let me be myself.  He hated real expression and did his best to stifle me, which makes sense because he has no real expression(besides anger).  So here I am, over a quarter-century old and I'm angry and bitter at the world.  I was never allowed to discover myself or be ok with my emotions.  And now, because of shitty parenting, I've become my dad - a hateful, empty vessel unable to love and unable to let go.  

I'm very upset because he emotionally abused me as a kid and he stunted me.  This amount of damage had to be intentional.  To this day he still feels good by putting me down.  He knows my weaknesses.  He always has.  That's why it was easy for him to program me for failure.  And its too late.  Looking back, even at age two, I see that I didn't feel safe being myself.  My whole personality is built on hiding from the shame I experienced and the fear from being unwanted and unseen.  

I don't think that therapy will help me, unless i lie to my therapist about my progress.  I get my self esteem from being someone i'm not, and its been that way for so long, I don't know who I am.",11
190,Do you find yourself mistrusting confidence?,5,ee3rnr,https://www.reddit.com/r/NPD/comments/ee3rnr/do_you_find_yourself_mistrusting_confidence/,5,1577012702.0,"My partner and I have been apart now for just a couple of days, just the beginning of a long separation that won't end until the end of January at the earliest.  In the past, separation has been a big trigger for me, leading to feelings of despondency, loneliness, anger and eventually withdrawal.  

Perhaps because I'm more prepared (mentally and emotionally) for this particular stretch of separation than I have been in the past, I feel strong.  I feel confident in my ability to control my narcissism and in my ability to prove to my partner that earning her trust is important to me.

And my first thought is to be suspicious of that confidence.  

One of the things I truly hate about NPD is coming to the realization that you cannot trust your own emotions and reactions, and therefore I end up second guessing any extreme emotion that I experience.  Should you feel confident about this?  Should you REALLY?  Does it mean you're taking things for granted, falling asleep at your post?  Is it going to make you even more likely to lose control when emotions run high?

I hate asking myself those questions, they make me feel tired and angry.  I want to just...BE CONFIDENT, BE HAPPY...except I know that just happily going along with the good times means I'm less prepared for the bad, and that means explosion.

My partner pointed out to me not too long ago that I should be planning for the bad with every bit as much gusto as enjoying the good...I guess I'm still learning that.

Do you ever really trust yourself enough to be confident?",5
191,can NPD make you prone to feeling angry at the world and completely misunderstood?,7,8xxvnc,https://www.reddit.com/r/NPD/comments/8xxvnc/can_npd_make_you_prone_to_feeling_angry_at_the/,5,1531298312.0,"by misunderstood i mean feeling like no one can relate to you, desperately longing for someone to understand you and than experiencing intense anger towards the world when they cannot at all understand you or your pain. 


i'm in a BPD FB Group and literally i can't scroll down the page without feeling envy for others getting nice comments and support, i feel like an abused dog out in the open with no one giving me support. i also feel jealous and super bitter when others are discussing relationships. when someone offers me help i become hyper defensive, my ego becomes on alert and i feel i need to protect that at all cost, i than feel i need to convey my superiority and awesomeness to the person trying to offer me help, i feel i want them to ''accept me'' and realize that they are talking to a possible narc.

are these incel + BPD + NPD qualities?",7
192,"I've been seeing a lot of comments lately on male BPD and how it can look like Narcissism, what are some traits men with Borderline Personality Disorder can have that are similar to NPD or exactly the same?",5,bvfvcp,https://www.reddit.com/r/NPD/comments/bvfvcp/ive_been_seeing_a_lot_of_comments_lately_on_male/,19,1559354818.0,"I obviously haven't been diagnosed as NPD because most psych shrinks are useless when it comes to Male Mental health, and instead just throw a Depression/Impulse control issue on you. But from what we no i DEFINITELY HAVE BPD, as my father does, and it does cause so much shit in my life, problem is like a typical person with BPD i do not have those intense mood swings that go from excessive highs to lows, i also don't cling for my life if someone leaves me, however according to others apparently i do have abandonment fears. I just wanna know what diagnosis can be given to a young man with severe anger issues, identity issues, a man meeting 5/9 criteria for BPD and 6/9 for NPD. How does Narcissism look like in men with BPD who are not co morbid? do Male Borderlines suffer with Narcisisstic rage/envy, grandiosity, aversion to treatment or fighting with therapists, and being homicidal or would a male BPD displaying these traits more than likely be a comorbid ASPD or NPD?? What Narcissistic traits do BPD men show? do they still need validation, supply, attention, can be sadistic at times?  generally are they good people with a lot of empathy because they feel others pains or is everything i listed a comorbid diagnosis consisting of BPD/NPD, can you have BPD as male and meet full criteria for NPD but not have NPD?",5
193,"Went to therapy last week, believe there is no hope. I am sure it is NPD/BPD.",6,feu7xj,https://www.reddit.com/r/NPD/comments/feu7xj/went_to_therapy_last_week_believe_there_is_no/,2,1583582287.0,"I am starting to realize i am becoming a bigger and badder monster. No amount of ''therapy'' will help or fix this animal i have become. I have missed so many appointments and sabotaged every little shred of betterment. As a result of the public system (Australia), i must attend a few pointless sessions to gain the trust to make sure i will attend CBT, Because it is not about the patient, it is about getting paid$$$.

Last week i was literally just sitting there and explaining my whole pathology and she just had a ''Aww baby'' look on her face. It exhausted me. i got home and went into a fit of rage, i beat myself over exposing myself and oversharing so easily.

i think it is pointless to literally blackmail me by telling me to attend a few sessions before referring me to an actual psychologist.

I have no hope, the same abusive patterns continued in my life after returning home from therapy, particularly towards people online. It did not change anything, deep down i am still seething with rage and i believe nothing will ever help the unique human being i am. I am a serial Narcissist but one with the ability to have empathy. It took years of studying myself to recognize that i am a very rare specimen. I am a pathological liar, i am sadistic in every way, i feel envious all the time, i see everything as a competition in which i need to win, i am highly grandiose. I feed over hurting people and starting drama, i am a bully and i enjoy being a bully. A relationship is a means to an end in which i need to win, it is all about making the other person lose and crumble.

Sometimes i am able to reflect on my behavior and feel slight remorse, but most of the time i just don't care enough to feel any sorrow. I see society as a place that has destroyed me and as a result i am doing my due dilligence by abusing everybody emotionally in a very controlled, articulated, cunning way.

Many times i sigh at a therapist because i feel pissed off they don't appear as knowledgeable as i am when it comes to therapy. People on here keep saying ''get help'' and i have now, but i am just not committed, i am not interested in sitting and taking accountability for being some ''bad person''.

I can't even do DBT, because i would only use DBT as a means to manipulate all of the girls with BPD and low self esteem and use them as my narcissistic supply. I also wouldn't be able to handle listening to other ''losers'' personal stories, i hate most of mankind so how can attending a group setting help?

I feel there is truly nothing to fix, i recognize i need help in some areas but i just do not care enough to actually challenge it. It is all gonna take years of work, that is if no one triggers me in the process, but i am doomed. I guess i'll be another Sam Vaknin who will just be self aware but never do anything about it. Even though my IQ is a disability, I feel so grandiose to the point i believe that i have a ''gene'' like Ted Bundy and that this makes me special, i genuinely believe that i have some inborn psychopathy, this enhances my feelings of superiority and i feel like a silent mastermind. I love dictators, i see them as if they are me, i am also obsessed with women who have NPD. I virtually hate all BPD women and spend most of my time trying to tear them apart.

I am actually capable of improving some of these traits, but they come at the cost of other peoples needs. Some of these needs include: not triggering me, validating all of my suffering and trauma, validating that many times i am right and not wrong, having male role models, easing my defenses by treating me how i wish, and also giving me tips on better emotional regulation, anger resolution, conflict resolution skills, positive thinking.

I forgot to add that reading many triggering things online is set to trigger a full blown episode in me, in which my homocidality is exacerbated, and trigger episodes of cutting myself, as well as tearing up on bed and having thought of overdosing on all of my meds. My mood is generally okay and i do feel empathy for people who may be hurting but this is selective and my brain decides who to turn empathy on for.

I am tired of being dismissed as having ''traits'', i want full recognition of my personality disorders,i feel if i do not get this i do not see myself as moving forward ever, and yes i care about a label more than getting better. It is something that a therapist or redditor will never change.

Malignant NPD & BPD describe me to a tee. \*my granddad had ASPD, and my father has BPD\*",6
194,What can we do about scary anti-narcissist material?,8,6f38d3,https://www.reddit.com/r/NPD/comments/6f38d3/what_can_we_do_about_scary_antinarcissist_material/,15,1496520653.0,"The YouTube comments on this clip are the scary anti-narcissist stuff that you might expect but this one is only just slightly more scary than funny. The poster starts:

> I have zero tolerance for narcissists and I do not recognize my ex as a human being.

Zero tolerance of a diagnosed personality disorder... Ok, not nice and we abhor but expect that. Failing to recognise someone as a human being in this context encourages an entitlement to restrict this person's rights. This is followed up with a dose of schadenfreude.

Are we getting to the point that this can be considered hate speech? Personally I feared replying as my Google account is too identifiable. 

There's so much of this material on /r/narcissism/ which is bad enough and I assume within Reddit's rules. YouTube though, that's another story. A story about angry people feeling empowered to publicly speculate about how they'll punish people with a psychological disorder.

[Source: https://www.youtube.com/watch?v=iYOSX7jjhmE&lc=z12dzz4hgxqovhjsl22ft1ow0xiayvtgs04](https://www.youtube.com/watch?v=iYOSX7jjhmE&lc=z12dzz4hgxqovhjsl22ft1ow0xiayvtgs04)",8
195,"I think I’m a narcissist, but an insecure one?",10,d8f0xa,https://www.reddit.com/r/NPD/comments/d8f0xa/i_think_im_a_narcissist_but_an_insecure_one/,6,1569282384.0,"So for a long while I’ve had trouble connecting with people, as well as problems with empathy. I’ve always attributed this to possibly having ASPD, but I think that I’m more in line with NPD. I’ve alway been one to act defensive or angered(?) when people criticize me, I absolutely hate it, and I fear getting old, I feel like if I get old I’ll be ugly and no one will love me. Another thing is that I’m obsessive about looking good, I have to have a cute outfit, makeup done, and be thin. If I gain wait it destroys me.  One more thing is that when I start talking to guys, I get needy(?) any time they take long to respond I feel like they don’t like me anymore and I always question how I’m being perceived as by them. But at the same time I get bored/lose interest in them within the first day of talking, and only go for people I feel are attractive for social status. If my friend says a guy I think is cute is ugly I’ll stop likening them because I don’t want people to think I have bad taste. 

There’s more so feel free to ask for anymore examples, but I was wondering if it sounds to you like I might have NPD. I am in therapy but have not done extensive testing to be diagnosed with anything as I am only in it for behavioral problems. 

Anyway thanks for taking the time to read this :)",10
196,How to do things you don’t want to do,5,ep2a82,https://www.reddit.com/r/NPD/comments/ep2a82/how_to_do_things_you_dont_want_to_do/,3,1579094634.0,"Hi all,

I wondered if someone could relate to the following. I finished my clinical therapy a couple of months ago and after I returned I got back at my job (lawyer) and I experience a lot of resistance to actually do something at work. it’s like my inner child is angry and doesn’t want to do something it doesn’t really want to do. 

I also experience a lot of anger and pain because of being around my colleagues who are having like a really good time with each other but I keep feeling like I’m being ignored. This need for admiration and attention is unlimited and I am really struggling with limiting myself in that need which is causing a lot of stress pain and anger. I do realize that I also have to play a part in making contacts so it’s not only receiving but also giving but I’m having a lot of resistance in giving in contacts because I feel like other people should come to me first. I also talked with these colleagues about it and shared my struggles and they said that it’s hard for them to help me which they really want to do but they’re not sure how. So I know they have good intentions but deep down I still don’t believe them and think they don’t like me.

This happens every day after which I don’t wanna do any more work because my inner child is saying what the hell does it matter I don’t wanna work nobody likes me and what am I doing here. I should also say that I’m not thrilled about the job because I get lonely behind the computer and I actually wanna work with people although I’m really scared of people I really want to make contact with people and have meaningful relationships.

FYI I’m diagnosed narcissist (covert)/avoidant.",5
197,Am I trying to move from Shy to Overt Narcissism?,4,6lkwra,https://www.reddit.com/r/NPD/comments/6lkwra/am_i_trying_to_move_from_shy_to_overt_narcissism/,16,1499337216.0,"Hi there. I was wondering if anyone had some thoughts on what I have to say.

I've never been diagnosed with NPD. But I suspect I have it. Only with me it's the 'Vulnerable Narcissism' kind.  I'm sensitive and very lost. I don't think I have much empathy. I suffer. A lot. I would describe my biggest problem as 'not having access to my self, my power, my own emotions'. I feel, most of the time, like this dulled, numb, detached version of myself. There's this ever-present wall between me and other people. When I want to say or do something it goes through some kind of filter and emerges weak and detached. It's hard to explain.

I check most of the the NPD boxes, especially concerning Narc Supply, when I read about it online (what a nightmare that is) especially the characteristics for 'Vulnerable Narcissism'.

Lately I've become obsessed with this idea that I have to break free and possibly reach my real emotions or 'true self' by basically: raging. I want to 'shout myself into existence', destroy my inner-filter/wall. What I'll end up reaching  is not clear, but I am convinced it will take me somewhere new.

I regularly have fantasies about  destroying things in my apartment, smashing my fist through my television, topping over shelves, possible making myself bleed (yes I know this sounds very BPD) and shouting at the top of my lungs: ""IT NEVER STOPS, IT JUST NEVER STOPS!!!"". The sole intent though is to be BRAVE enough unleash all these emotions, and getting to the center of me (I feel permanently outside of myself).  But I can't, im honestly too afraid of what the neighbors might think, and I don't know when I'll be able to stop. But in all honesty it feels like a 'healthy' thing to do.

Living like this, outside of myself, living in depression and 're-actively' (as opposed to actively),  is not some small thing, it's become my life for the last 15 years and I can't take it anymore.

I understand this is trapped energy that wants to be released. But I don't know how to do it, or don't dare to. What will come out is very dark and twisted, perhaps. I'm not crazy about the idea of having people worry sick about me if I end up hospitalized, or that my cat will freak out and feel afraid, or that the neighbors will be scared of me, it's not like I don't care, I just honestly think it would be better for me, and hence  everyone else in the long run, because I feel useless to society right now and also useless to the people that I know care about me. I don't want to live in this empty shell of an existence anymore. This person I've become:unable to love, care, emotionally connect, stuck in my own head.

What I think is this: I think my body/mind is trying to break out of Vulnerable Narcissism and into Classic Narcissism. It is quite possible that I just don't have the balls to be a Classic Narc, and I think this might be applicable to most, if not all Vulnreable Narcs. I read somewhere that Vulnerable Narcs cannot access their own emotions, that they think they have empathy, but they don't and that Classical Narcs are easier to treat. Is it possible that I'm trying to metamorphosise? Does anyone have any thoughts or experiences with this? If you think about it, what I'm saying has some logic to it.

I cannot reiterate the term 'shouting myself into existence' enough. That's the real aim of the rage. I feel detached from myself, and emotionally detached to everyone else too. I think what is trying to come out is the frustration, the pain, the mistrust and anger  I have toward people, I want to exorcise it, I know this might be wishful thinking, but there are moments when every bone in my body is telling me to do this (act out), or maybe I should say, my heart is telling me to do this, but I can't do it.

Here's a list of things that make me think I have NPD:
- Unable to emotionally connect or care about other people, when I do it's shallow.
- hyper-vigilance. Intense feelings of being unsafe in all sorts of environments
- completely obsessed with my own feelings. Utterly absorbed by them, which makes me HIGHLY self-centered, little room for other people thoughts/feelings.
- a 'true self' that doesn't seem to exist. An empty feeling in its place.
- a very large need for confirmation/adoration (adoration is preferable) from others
- sexual addiction, which I believe more and more is about power as opposed to lust. Sex and porn is basically my Narc Supply.
- Massive avoidance-style behavior. I live a bit like a teenager, I've never had a job I really liked (all minimum-wage paying jobs until now) and I'm in my mid-thirties. I avoid real jobs and projects because I'm afraid of looking stupid and being shamed (lots of shame issues).

But anyway, I'm  not hear to convince you I'm a narc. I want to know if others experience something like this, what you think? I know I'd like it if I were to read these words coming from somebody else.

What are your thoughts on my raging/shouting myself into existence? It might be a hissy-fit but it might change my life. I also might add that I experience the same feelings with more positive emotions too at times,  like joy..sometimes I want to shout that 'I'M ALIVE!' and give people hugs. I kid you not (not very Narc-like perhaps).

To those who think raging is not a good idea please tell me why.
Thanks for your words.

",4
