,title,score,id,url,comms_num,created,body,ups
0,Anyone ever get in large social settings and just get upset for no reason violent tendencies or thoughts and anger this happens to me sometimes not always.,6,rhl91y,https://www.reddit.com/r/NPD/comments/rhl91y/anyone_ever_get_in_large_social_settings_and_just/,3,1639638619.0,,6
1,Consumed By Anger,8,raa597,https://youtu.be/wviiGjwZHWU,1,1638805366.0,,8
2,How do I empathize with anger instead of being defensive/escalating?,11,qb8e4f,https://www.reddit.com/r/NPD/comments/qb8e4f/how_do_i_empathize_with_anger_instead_of_being/,10,1634638172.0,"(Idk if I have npd, but this fits w symptoms)



When someone is angry at me and says things in a certain way, instead of listening to them I lash out and escalate the situation, making them even more upset. I was told that what I do is tone policing. I think I do this because I perceived it as an insult. I find it difficult to be sympathetic or understanding of someone when they snap at me, are short with me, are visibly annoyed, etc.",11
3,I've realised I don't feel anger,9,pqzus1,https://www.reddit.com/r/NPD/comments/pqzus1/ive_realised_i_dont_feel_anger/,22,1632019614.0,"Hi,

Throwaway account for obvious reasons. Not diagnosed NPD but pretty sure I am, or at least have traits. 

As a kid and early teenager I was really naughty and I guess had a temper. Quite rebellious etc. Now I'm always trying to please people (to a fault). 

I've realised that as an adult, I never get angry. I'm not sure exactly when I stopped feeling anger. I do feel some other emotions (at least envy, self-pity, frustration and guilt) but noticeably anger is missing.

Can anyone else relate to this? I think anger is probably a healthy emotion to feel sometimes, so the fact I don't concerns me. Did anyone find anything that can help?",9
4,advice on anger?,5,pjqvj6,https://www.reddit.com/r/NPD/comments/pjqvj6/advice_on_anger/,2,1631033257.0,"ive been so irrationally angry the past month and unsure how to cope with it. the usual things dont do too much anymore, everyday i seem to feel worse. one of the only things that helps is being away from people out in nature but i really cant do that all the time with my busy life. anyone got anything that helps?",5
5,Dealing with anger outbursts,5,pr8h3e,https://www.reddit.com/r/NPD/comments/pr8h3e/dealing_with_anger_outbursts/,0,1632060041.0,"Hi,

What are everyone’s tips for dealing with anger outbursts that stem from entitlement?

I always regret whenever I have one and am repulsed by my behaviour as it reminds me of my father, who has this inherent sense of insolent pride.

Yet I don’t know any techniques that can help me when I’m in these situations.

I seem to have no shame in raising my voice or making someone feel fear if I feel I’ve been wronged, slighted or if someone has done their job incompetently.

E.g today I thought the bus driver lost my suitcase and I went insane, turns out it was somewhere else and I could’ve just remained calm.

The ‘scene’ that I made was definitely beyond what was needed.
It’s like in those moments I’m running on something I can’t control.

This is maybe not a good example as it could be written off as mere anger issues and not NPD, but it’s the way in which I treat people as if they’re not human — people I don’t even know.

I have seen therapists before although not specifically for anger management, I know that would be a good logical step, but I wondered if anyone had has some practical tips or resources to share?

Thanks",5
6,Self awareness is the worst thing that ever happened to me,51,rkgk5u,https://www.reddit.com/r/NPD/comments/rkgk5u/self_awareness_is_the_worst_thing_that_ever/,29,1639981376.0,,51
7,"Rant. It’s difficult to both face anger issues and face narcissism, because I want to believe my anger is valid. Looking at it as a reaction to my childhood helps.",11,o3teou,https://www.reddit.com/r/NPD/comments/o3teou/rant_its_difficult_to_both_face_anger_issues_and/,9,1624148260.0,"The other day I talked one on one to a family therapist. She suggested the role I was playing in my family growing up was to get upset about all the problems no one else was addressing. She said that by getting upset, I was actually doing the emotional work for them, so they didn’t have to deal with it (unconsciously ofc). They could say I was just crazy and completely ignore the problems at hand. This makes sense to me.

So. Apparently, I would lash out because of problems not being addressed due to neglect. So all these years, my anger has been valid...

But, it’s obvious my behavior and reactions to that anger is “inappropriate” and I HATE that word, because *i* feel my anger is appropriate. It makes me feel so invalidated. And yet, there’s obviously a problem. I want to face that problem without submitting to the idea that I’ve just been crazy. I want to feel valid. But it’s really hard when my family still treats me like I’m crazy. I’m SO sensitive, and yet I hate to say that because truthfully, I’ve just been gaslit into thinking that. 

But also...EVERYTHING upsets me. Tiny amounts of disrespect put me into a rage. I’m just so angry and exhausted. This stuff is so hard, but I think I’m improving slowly.",11
8,"What the fuck does ""unmasking"" mean?",7,roheci,https://www.reddit.com/r/NPD/comments/roheci/what_the_fuck_does_unmasking_mean/,16,1640466127.0,"I've been struggling with this lately. 

Recently I was involved with someone who suspected she had NPD and possibly ASPD traits. I took her word for it, but she would say how she wouldn't ""mask"" around her friends. That fuck?

Like for me there is nothing but masks, maybe one will be a little more honest than the others, but at the end of the day it's just a part I'm playing. I'm not even sure it would ever be possible to stop that.

Then again she wasn't diagnosed like me so maybe she just misidentified herself as NPD. It wouldn't super surprise me. Or maybe I'm just gatekeeping lmao

What's everyone else's experinces with this?",7
9,Stop Beating Yourselves Up: A Communique,75,r2oqc0,https://www.reddit.com/r/NPD/comments/r2oqc0/stop_beating_yourselves_up_a_communique/,27,1637937100.0,"I've read enough of the navel-gazing in this subreddit to see a common pattern. NPDs here beat themselves up for past abusive behavior, lack of empathy, self-centeredness, and so on.

The truth is, a lot of non-mentally ill people in the world don't have affective empathy either. If they did, then we wouldn't see things like genocide or homelessness. What, you think all the Hutus that murdered all those Tutsis in Rwanda were NPD or ASPD? Beating yourself up for something that a lot of normies don't even have is not only counterproductive, it's also self-absorbed. Woe-is-me kind of shit. Typical of vulnerable narcissism.

What separates us from the normies is that normies hold themselves accountable (for the most part) and they stay true to certain values like kindness in their daily lives (for the most part). A lot of narcs around here don't seem to have any values at all beyond being famous, wealthy, or having a bunch of groupies. 

Even the narcs that seem regretful: no real values. The narcs that castigate themselves see themselves as unfixable. Let's be honest: if you work hard, you can be kind, considerate, and trustworthy in the long run. You might even have intimate and loving relationships. Enough of the pity parties, guys. Go to therapy, adopt some values to guide you through tough times, and work on being considerate in spite of your impaired empathy.",75
10,Just got ghosted experiencing a narcissistic collapse,42,rssbtz,https://www.reddit.com/r/NPD/comments/rssbtz/just_got_ghosted_experiencing_a_narcissistic/,37,1640951630.0,I don't even feel upset I just feel anger. If anything I should've been the one to ghost & I would've eventually it sucks so bad for my ego. I wish my ego didn't get hurt so easily.,42
11,How do you respond to being talked down to (condescending)?,6,rg2zy4,https://www.reddit.com/r/NPD/comments/rg2zy4/how_do_you_respond_to_being_talked_down_to/,18,1639470529.0,How do ya'll react to condescending behavior or feeling like you're being treated like a child etc?,6
12,I’m new here. Tips on how to be a good partner?,16,r35wn2,https://www.reddit.com/r/NPD/comments/r35wn2/im_new_here_tips_on_how_to_be_a_good_partner/,17,1637989430.0,"I’ve suspected that I’m a narcissist for a long time, but recently it’s been worse. I’ll be so mad/irritated at my partner for absolutely no valid reason—she is a wonderful partner. 

What helpful techniques have you learned about how to be a good partner with NPD?
Also, can we be good people?",16
13,Cool Article on Metacognitive Interpersonal Therapy,1,rr7ksb,https://www.reddit.com/r/NPD/comments/rr7ksb/cool_article_on_metacognitive_interpersonal/,3,1640782533.0,"Enough with the Vaknin inner child pop psy bullshit. Here's a promising psychotherapeutic intervention that gets at some core issues of NPD. I invite you to read this article.

[https://www.researchgate.net/profile/Giancarlo-Dimaggio/publication/228063377\_Metacognitive\_Interpersonal\_Therapy\_for\_Narcissistic\_Personality\_Disorder\_and\_Associated\_Perfectionism/links/5a4c9b67a6fdcc3e99d04394/Metacognitive-Interpersonal-Therapy-for-Narcissistic-Personality-Disorder-and-Associated-Perfectionism.pdf](https://www.researchgate.net/profile/Giancarlo-Dimaggio/publication/228063377_Metacognitive_Interpersonal_Therapy_for_Narcissistic_Personality_Disorder_and_Associated_Perfectionism/links/5a4c9b67a6fdcc3e99d04394/Metacognitive-Interpersonal-Therapy-for-Narcissistic-Personality-Disorder-and-Associated-Perfectionism.pdf)",1
14,the pain of shame,11,r5u4o4,https://www.reddit.com/r/NPD/comments/r5u4o4/the_pain_of_shame/,6,1638297660.0,"I want to ask for advice/perspectives/any help you can possibly give.

I am usually a pretty calm person but there are incidents where I can experience narcissistic rage. it's pretty rare and only happened twice in the past few years. but it's usually the same situation: I am vulnerable and trusting of someone and then I find out that person lied to me over a period of time and/or betrayed me with someone else.

something that anyone would be angry about I suppose. but the pain this specific situation brings me is so overwhelming, that it can almost immobilize me for a few days and usually drops me into a suicidal spiral and intense rage.
I don't let it out on anyone but it boils in me and kind of eats me from the inside

what hurts me the most is a) the fact that I was lied to and believed it and b) that there is another person they chose, that is ""better"" than me.

I'm pretty sure the reason this pain feels like it almost rips me apart physically is because the underlying emotion is shame. and thats like what npd is mostly based on.

the thing is, in these situations I have a very hard time coming out of it. when it happened in 2018 it took me about a year to function again. there was a S attempt and I had to go to a clinic for a few months. the anger only slowly subsided.

now I'm in a similar situation and everytime I think about it my nerves feel like they are filled with hot water. and thats basically constantly.

I am very angry but also resigned because I know I have no way to get ""justice"".

I try to deal with this in a logical way but as of right now it feels impossible. I can try to calm down a little but the second I think about it again the paralyzing pain comes back.

any tipps? insight? ways to deal with the chronic shame inside us?",11
15,Intense need for control,4,r0c4oi,https://www.reddit.com/r/NPD/comments/r0c4oi/intense_need_for_control/,7,1637670510.0,"I’m not sure if this is my narcissism or anxiety or a mix, but whenever things don’t go my way like when I plan something and other people don’t listen, I end up having to absolutely go off at them to even try to get them to understand how they’ve fucked up. I know that it’s often an overreaction but I’m filled with so much anger that I can’t help myself in the moment. I think it’s the concept of not being in control that triggers it. Has anybody else experienced something similar?",4
16,Impulsiveness and emotionality. Does anyone also have a problem distinguishing between these concepts?,4,qy6dkb,https://www.reddit.com/r/NPD/comments/qy6dkb/impulsiveness_and_emotionality_does_anyone_also/,11,1637417499.0," For a long time I have described myself as ""very emotional"". I considered myself to be so. By this I meant that I often react quickly, spontaneously and ""follow my heart"" or my intuition/gut feeling without considering the pros and cons.  In one word, I do what I want on the spur of the moment. Now I think it's more impulsiveness than emotionality, although I still don't get the exact difference. Or is it that emotionality is not about action, and impulsivity is primarily about reacting by doing? I don't know, maybe someone can understand it better and explain it to me. Because I'm more and more sure that I was wrong, that is, I was mistaking these concepts ...And if I told myself I should be ""less emotional"", it was rather that I wanted to be less impulsive. But are these concepts not related to each other?

>Emotionality is the observable behavioral and physiological component of emotion, and is a measure of a person's emotional reactivity to a stimulus. Most of these responses can be observed by other people, while some emotional responses can only be observed by the person experiencing them.  
>  
>Impulsivity is a multifactorial construct that involves a tendency to act on a whim, displaying behavior characterized by little or no forethought, reflection, or consideration of consequences. Impulsive actions typically are ""poorly conceived, prematurely expressed, unduly risky, or inappropriate to the situation that often result in undesirable consequences,"" which imperil long term goals and strategies for success. A functional variety of impulsivity has also been suggested, which involves action without much forethought in appropriate situations that can and does result in desirable consequences. ""When such actions have positive outcomes, they tend not to be seen as signs of impulsivity, but as indicators of boldness, quickness, spontaneity,   
>  
>source: [www.definitions.net](https://www.definitions.net)",4
17,What's the Deal with Masking?,6,roj4d4,https://www.reddit.com/r/NPD/comments/roj4d4/whats_the_deal_with_masking/,14,1640472018.0,"I feel like many people on this subreddit have this neurosis about masking.

I don't understand why. Masking is needed for our kind of society to function. If your boss pisses you off at work by assigning you to work over the weekend, you don't curse out your boss. You suck it up, smile, and work. Well, you can quit or organize a union, but that's for another day. ;)

Likewise, you narcissistic peeps have to cover up your grandiosity, envy, or whatever. That's not bad. That's just a survival skill. If you get entitlement rage, are you gonna display your anger and drive people away? Of course not.

Be advised that *masking* is similar but different from *image management*. You can manage your image through masking negative feelings. That way, people won't think you're neurotic. I suppose that masking is a technique that helps you manage your image.

As always, let's have a discussion about this.",6
18,Vehicle for Hatred,9,rsdrpm,https://www.reddit.com/r/NPD/comments/rsdrpm/vehicle_for_hatred/,6,1640902449.0,"Sometimes I feel like I am a vehicle of hell and hate. It's gotten to the point where that's all I really feel. 

Fear, anger, jealousy, and lust but that's not really an emotion in my book, just a need to release something and let my thoughts melt away and get horny tunnel vision for a few minutes until its replaced with cold sickness. I have a need for violence. Orgasmic fast violence, to myself and others. My head impacting with some hard red object at the speed of an ejaculation, my teeth embedding themselves in it and ripping out of my mouth leaving a hilarious gummy open mouth smile, my eyeballs embedding themselves too but they stay attached to the socket so when my head rushes back from the sheer force of it they stretch back. Its happens so fast that everything overlaps each other like frames in a cartoon, it happens in the blink of an eye. I can see it clearly. There's an orange sky behind me. And I'm smiling. When I think of that I feel a little loose in my legs, brings a little shiver to my spine, it's the kick I need, it brightens my day. Maybe if I was more violent I'd be more close to myself. If I lost everything, every bit of self control, and slammed someones head into a wall I would wake up from my coma. Just one violent act would make everything make sense. I'd break down crying. 

Does anyone else indulge themselves in success fantasies that titillate them but then when you think too long about them, they start to become terrifying? Does anyone else feel like they'd be happier if they just accepted being a loser and stopped chasing things, but also stopped relying on other people for anything? Disappear from the people you know and love and the people who's eyes you imagine when they are not near you, go somewhere where no one knows you or there is no one there to know you, stop talking to others and overtime stop talking to yourself and then just, blip. In the nothing, the big white light in your head will sink down to the size of a slowly spinning, small pulsing dying star, and then it will sink down more and more and more until it disappears. 

And then you'll walk out of the forest and you won't remember a thing about yourself, you won't remember a thing about your past or your present or your future, you won't understand those concepts to begin with, you won't know words or bodies or actions, you won't know and you won't care. You will walk out, and your mind will start over. Unmolded. And on the way back to nothing, you'll be molded only by the woods you walk through. And it will heal you and it will build you stronger walls. 

 Cover yourself in dirt and shit and grime. Being nothing feels like the only way to be happy. 

I don't want to lobotomize myself anymore. 

&#x200B;

I want to be a caveman.",9
19,How do you get diagnosed with NPD? What is the process and how long did it take?,14,r2acz9,https://www.reddit.com/r/NPD/comments/r2acz9/how_do_you_get_diagnosed_with_npd_what_is_the/,3,1637886064.0,"So, I am new to all of this. I am wondering about the process of being diagnosed with NPD. For example, if and when an individual confronts the need to have a psychological evaluation, is it common to receive a diagnosis from the first evaluation? Will lying - which is a common trait - obscure and prevent a diagnosis? Basically, what were your experiences of getting a diagnosis?",14
20,Vent,3,rqlydt,https://www.reddit.com/r/NPD/comments/rqlydt/vent/,4,1640715329.0," I posted an insta story asking if anyone would like to invite me to a/their Sylvester party.. well 30 ppl read it and I got no answer. To add to that I'm the kid who never gets invited anywhere, an I mean NEVER. Growing up I've never had a friend group, now I have no one that I feel emotionally close to. Also the fact that they do this partying  and friendship thing implies that they're better than me which is something I can NOT let happen. 

Like wtf am I doing wrong? I don't look bad, I maintain proper hygiene and I'm smart, smarter than kost of them (IQ) and I act friendly towards everyone and even pretend to care about what they're saying. So why am I always the worst or the last choice or simply the girl that gets overlooked?
And honestly, I don't know I should feel about that: I've already thought about multiple scenarios that I could initiate:

1. I pretend to be very mentally unwell (which I am btw) and thus score sympathy points just like I tried from the 7th grade on where I was considering jumping out of the window and having the fantasy that someone would stop me and everyone would dramatically gather around me and shower me with apologies and sympathy.... but it didn't work so I'm not certain that it will this time

2. Isolation. Completely retreat from society and play the 'mysterious loner' that means on new years eve I'll go into the city on my own, buy myself a bottle of wine and proceed to drink it while sitting sad on a bench or something. I'd start going to the gym again and maybe they'll finally pay attention when I look better than all of them (now I'm about half way there) Like why do I not have a boyfriend? I'm skinny, have visible abs and my face is not that bad too but for some reason I've never even had my first kiss. Plus hearing people rank about whom they've already made out with at my age makes my blood boil, like 'why does this not happen to me' and 'now I am even lower on the social hierarchy and look even worse in front of everyone'
Also btw am somewhat incompetent at maintaining relationships since idk what the hell people talk about. Is it life experiences? Too bad, because I remember almost nothing before 10th grade (13years). Like how do people keep that up? I seriously wanna know? Because in one hand, my therapist told me that affective empathy is only possible if you like yourself, even though a lot of people dont like themselves and they still got friends somehow. Hell, some don't even deserve the amount of friends they have which means at even those who are much less worth than me still have a better social life.

3. Revenge: The amount of anger I feel is pretty high ngl, which is kinda weird because I feel both like I can't feel any anger but then at the same time I have the urge to tell them to just go fuck themselves and get revenge for what they've done which may make them fear me which in return finally gives me some ounce of respect and maybe then ppl will start to associate with me.
Because for some reason I don't care about emotional intimacy, because you can just fake it and because I know that that'll never happen to me lol and the othe. And furthermore friendships or specifically having a social life kinda builds this image of yourself in which you are worth something because you're somewhat high in the social hierarchy which ofc makes you look good and thus you're better than other (which is like my only legitimate goal in life, to be better than those people I come in contact with and yes it's unrealistic but still, can't allow myself to be worse no matter which aspect of life lmaooo)

Holy damn this was long.. if you made it to here: wow you're bored/ but also thank you cause I feel that this is the only place where I can vent my thoughts that some would probably understand . 

FYI IM NOT CLINICALLY DIAGNOSED!! I just feel like almost everything in this the most relatable shit I've heard lol so// also because I'm a minor too

_pardon my English for its not my native language_",3
