,title,score,id,url,comms_num,created,body,ups
128,inability to accept being a victim,4,i47ssg,https://www.reddit.com/r/NPD/comments/i47ssg/inability_to_accept_being_a_victim/,8,1596642664.0,"tw//sexual assault 

idk how to title this tbh, but bear with me. ive noticed a pattern of thought i always have, which is under mo circumstance would i allow myself to be a “victim” because in my head no matter how fucked up the shit i go through is, how badly someone treats me i HAVE to be tough and take it, i CANT be weak

ive gotten stuck in abusive relationships before, and it was never like “i love them i have to stay” it was more like i stayed to prove to myself that im strong enough to handle this, if i left, if i called it abuse, it would feel like running away, being a weak little bitch, it would mean admitting that this person had power over me which i could never do, so i’d stay and abuse them back to “balance” the power dynamic. this has been so toxic and exhausting for me because i refuse to admit i needed help

ive also gotten sexually assaulted last year and it took MONTHS for me to admit what it was, and still to this day i could never call myself a victim, i refuse to accept the fact that something traumatizing happened to me and that im hurt. only last month i got super drunk and spilled my guts to a male friend, he got very defensive wanted to know the guys name to beat him up, we had a huge argument about it because i refused to tell. because  going to beat up the guy for me would make me feel so weak, it would make everything too real, like admitting someone took my power away, the reality that obviously as a tiny skinny woman i cant take my revenge with my own hands. i got so mad at him for offering me help because i dont want to admit i need help, not from him not from anyone.
does anyone experience a similar thought process? how do you get over it and allow yourself to be vulnerable, to admit that you’re a human and sometimes you need help, that you’re not invincible?",4
129,Am I A Narcissist?,10,l1uv24,https://www.reddit.com/r/NPD/comments/l1uv24/am_i_a_narcissist/,6,1611219990.0,"
Before I begin to share I would like to preface that I have NOT been diagnosed with NPD nor have ever visited a therapist. 

From the beginning of the start of my own self-awareness - around junior high - I’ve felt as though I am intellectually superior to most others. I am very quick to consider myself a genius, going as far as taking online IQ tests to affirm my self identification. Adding to this superiority is the fact that I’ve had straight A’s my entire life. I also attribute most of my academic setbacks, such as not being in the highest possible classes, due to the stupidity of the rest of my class which forced me to slow down to their level and not be as prepared for high school classes. 

Around this time as well, many people have called me quick to anger and scary at times. They would label me with “anger issues” but every time I look at the events, they were caused by them provoking me.

For the majority of my life I’ve also been pretty mellow. I used to help people with some things but now have gotten to the point where I am just extremely callous and just do not care anymore. Especially since during Covid I’ve only held consistent communication with around 10 people. I am also a very introverted person. I tend not to allow everyone into my life, which makes me feel as though I project a false persona of myself. 

I also exhibit instances of a lack of empathy as well. As I’ve mentioned in the last paragraph, I’ve been recently very callous. But also I have abused others physically and other means I wish not to say. I’m aware of the immorality of such but I don’t know, I guess I just don’t care much. I do feel guilt at times but I just usually downplay it and forget about what I had done. I feel, as well, that I can harm others without much care either, but what fruit would such an action bear? I’m not a sadist so I don’t go out of my way to harm others, however, sometimes I may as a result of frustration with that person. Again, when that does happen, I don’t much care as long as they don’t pull that stupid ass stunt again. Adding to the anger I sometimes feel, I generally get super annoyed at my mother when she tells me to do tasks. Even menial tasks such as getting her water is met with a stark remark and “why can’t you do that yourself?” I sometimes think about this and how I make her feel sometimes because I am quick to yell, but no matter how much I’ve thought it over I am back to becoming upset at her for even speaking to me.

I also feel like I don’t have the ability to love, romantic or familial. I’ve never told my mom I loved her. Don’t really feel a need too either as it is just a word. I DO lust for women, but once I am in a relationship I get bored fairly quickly and wish to move on. However, I do feel as though I have actual love for someone as I am usually infatuated with people I cannot have, but I feel that most others do as well. But I do know that no matter how much and however long I am infatuated, it  would quickly amount to nothing once we are together. I have been labeled a heartbreaker and player by multiple people. I sometimes laugh about what I did and tell myself that they weren’t up to par for my own standards, mostly as justification.

My father has been diagnosed by a therapist as having narcissistic rage, so I will assume that he has NPD in addition. He has been somewhat absent in my life, BUT I do get along with him very well. I used to be extremely fearful of his bouts of anger, which were very bad at times, and now I haven’t angered him for many years now. I generally talk to him about topics that he enjoys himself as well, as he gets visibly upset and annoyed with constant questions or continuing a topic not of his interest. 

For the more notable aspects of narcissism, I do also exhibit those as well. I remember writing in my journal that I wished for the power of Napoleon Bonaparte. I considered myself as his reincarnation because of his dramatic rise to power. It is quite amazing I may add as he had total control over the majority of Europe. And I also think about my future being very successful. I often fantasize of being a billionaire and being wildly famous. I’ve also thought of myself as deserving of a woman such as Kylie Jenner, simply for her status and beauty. I would say that I am above average attractive. I am coy as well sometimes with others and downplay my highest achievements as if they weren’t that great and as if I could do better. I am quiet shy though and don’t have many close friends, less than 5. And I am prone to showing a high ego or confidence sometimes.

This may have been longer than I have intended to write, but I just wanted to share how I feel and not be so closeted mentally about my rationale and feelings. I just don’t want to think I’m such a bad person. And I know I may have listed things that fit every check, but it was not my intention to do so; simply just to share. I am not trying to list anything to prove that I have this disorder or anything, I could care less about having to prove this type of thing to people. I feel like I haven’t harmed anyone, but am I severely narcissistic or have NPD at all?? Am I fucked up? I’m happy to answer any questions or hear any comments.",10
130,"Hi guys, I don’t have npd but I’m looking for insight into this please.",1,lx9c7v,https://www.reddit.com/r/NPD/comments/lx9c7v/hi_guys_i_dont_have_npd_but_im_looking_for/,5,1614821055.0,"Hey all, so Id like to ask what it is about the silent treatment? Like why use it? Is it tactical, anger induced? This shit drives me insane man! I want to understand what it’s all about and why? 
Thanks",1
131,Is anyone else absolutely fine until they suffer an injury?,8,gp6ma4,https://www.reddit.com/r/NPD/comments/gp6ma4/is_anyone_else_absolutely_fine_until_they_suffer/,13,1590246997.0,"Hi all,

I'm not NPD but I have some pretty overwhelming narcissistic traits.  They only exist in my relationships with romantic partners and specifically only come out when I'm feeling threatened.

I am generally, selfless, empathetic, giving and nice but if I feel another guy is a threat to my security or if I feel I'm being overly criticized by my partner I lose my shit. I will scream and shout, say really abusive things, try to subtly cripple my partners self esteem and generally just dish out a whole heap if narcissistic abuse.

Then I calm down, get mortified by guilt and remorse and the cycle starts again.

If I don't feel an ego bruise/narcissistic injury I'm a really nice guy. Then my ego gets bruised by my partner talking about her ex fondly or saying someone is good looking and all of a sudden I turn into narcy the green eyed monster.

It fucking sucks. I hate that guy.",8
132,How to calm down from narcissistic rage?,17,jufm6c,https://www.reddit.com/r/NPD/comments/jufm6c/how_to_calm_down_from_narcissistic_rage/,14,1605412710.0,Mine is extremely intense and hard to calm down from. I’ve tried anger management techniques but none seem to touch the rage I feel. I hate being such an angry person all the time,17
133,I'm totally going bonkers. Losing my mind. - VENT,12,g43skb,https://www.reddit.com/r/NPD/comments/g43skb/im_totally_going_bonkers_losing_my_mind_vent/,14,1587282473.0,"Last year I saw a therapist for three sessions. He told me I have NPD. This opened the gates to hell. I read everything about NPD. It made me not only hopeless but also left me convinced I am a monster. Suicide became real for the first time in my life.

Due to different circumstances, I had to switch therapists. Now I am with someone I have been seeing for almost a year now. And she thinks that I don't have NPD but am more emotionally unstable. But in my head, I believe that I am a narcissistic monster. And I believe that she is not good at spotting the right diagnosis. The covert narcissism that is so hard to spot apparently.

I went to two other therapists to get other opinions. A lot of open style interviews and multiple-choice test later - they all said no personality order at all. It feels like everyone is guessing but I understand mental illness is very hard to classify. Deep down I just want another person to confirm I am a narcissist.

In sessions with my current shrink, I am bringing all this up. Aksing her if there is a possibility to just use therapy for supply. Telling her I have problems with severe self-hate and compulsive lying, lack of discipline, and social isolation (very strong). Lying is so fucking stupid. I lie for things that would not make a difference if I would tell the truth. Meditation helps me a bit to get over this but it will take years if ever to overcome it.

My conviction that I am a narcissist is so high that I view EVERY behavior through the lens of NPD now.

Looking in the mirror - Narcissistic Monster!

Telling my friend about my shitty day - Narcissistic Monster!

Going to therapy - Narcissistic Monster!

Lying - Narcissistic Monster!

Feeling extreme Anger (always keep it inside) - Narcissistic Monster!

etc.

When I first got the diagnosis I reached out to old friends and lovers and ask them if I ever hurt them, how they view me as a person. Especially asking my ex-girlfriend if she ever felt mistreated or manipulated by me. No one had anything bad to say about be. But maybe I am too good of a manipulator. It drives me crazy to question every tiny bit of my reality. How can I know what the true motivations of my behaviors are when I might be deceiving myself with everything.

I reread old recommendation letters and thought about how I behaved as a manager. And mostly I can see withdraw, being terrified about making mistakes, and hoping my workmates like me.  Plus lying! I always lie about my work history because sometimes I am so terrified about making mistakes I am just quitting very well paid jobs in the tech industry. Only to work labor jobs next week.

Additionally, I suspect avoidant PD as well because at 30+ I have very little sexual experience as well because I believe my I am not good enough. Few friends and I prefer to stay in my room.

Sorry for the rant. I needed to get it off my chest. In any case, I am thankful for this sub. I just recently signed up for Reddit and already found your guys' perspectives very helpful.

&#x200B;

EDIT: Hello Community! Thank you for all your perspectives. It is helping immensely. I just wanted to say that it was not my intention at all to do some kind of down-talking of the disorder NPD. Not at all. It is my understanding that it is all a spectrum instead of a clear cut thing. No one chooses to be traumatized. No one chooses to have a disorder. No one chooses to hurt people. A kid does not dream of becoming a socio- or psychopath, either. On the far end of the extreme.  All this goes without saying.  
The reason why I used the word ""monster"" (not a good choice retrospectively) was to clarify how neurotic I felt about the diagnosis. Like when I read about NPD I also read about serial killers that had NPD at some point and thought - This is me. Which is completely delusional. ",12
134,Does anyone else hurt people's feelings without meaning to?,0,lkhsnx,https://www.reddit.com/r/NPD/comments/lkhsnx/does_anyone_else_hurt_peoples_feelings_without/,8,1613408467.0,"Two days ago, a friend of mine helped me move furniture to a new apartment. I sent him this text yesterday morning.

""My heartfelt thanks for helping me with the move, Victor. Normally you help people out as a sort of ego thing, but I didn't get that impression yesterday. I felt as though you were not motivated by any desire to show off or feel like a good person, but that you genuinely cared about someone. That shows growth, and I am proud of you for that. You still have a long road to travel, but you've taken those very important first steps. I think it's only a matter of time until you mature into a person who cares about others besides yourself.""

I meant this as a positive, uplifting message. I was trying to draw attention to his good points. But he took offense to my message. His reply is as follows.

""Uh... thanks? I spend all day helping you, and this is the response I get? Why do you have to insult me and talk down to me all the time?""

I responded with the following. I admit that I lost my temper here. The anger itself was justified, but the excessive vindictiveness was not. I am not proud of that. 

""I did not insult you. I have never insulted you a single time. I have never done anything but call you out on out on your inauthenticity, maladaptive tendencies, and self-destructive behavior. I have done nothing but attempt to get you to question yourself and your internal motivation for your actions. I criticize you so much because I care about you and want you to be the best version of yourself. That's what friends do. If I did not care about you, I would not criticize.

This is why you and I shall never be friends. You have no self-awareness, no ability to introspect, and you want to be surrounded by yes men rather than true friends that exhibit honesty and guide you down the right path. The fact that you bristle at my criticism, gently worded though it was, proves your true motivations. You never cared about me. You just wanted to look and feel like a good person. A good person which, deep down, you know you will never be.

I take back every good thing I have ever said about you. I was stupid to believe that you could ever change. I was stupid to believe you could ever be a good person. I was stupid to believe in you.

I thank you once again for the help, but it is the last thing I will ever say to you. You've spurned my help time and time again and clearly don't want to be saved from your demons. You are nobody I would ever wish to know as friend. Goodbye.""

Once again, I emphasize that I believe the anger itself was fully justified. Most of my text was perfectly fine. There's only a few parts I would soften up because I feel they hit below the belt unnecessarily.

But yes, does anyone else have this issue? Hurting people's feelings without meaning to?",0
135,Exposed,4,lutt5k,https://www.reddit.com/r/NPD/comments/lutt5k/exposed/,2,1614555133.0,So i “dated” 3 guys at my high school (im a senior rn) and one I recently parted with really badly and he hates me so much. Last night they had a gathering with most of my classmates and i guess all 3 of them started going in on how horrible i was and they also found out im going to therapy so the last ex messaged me with “glad your going to therapy god knows you need it” i think a majority of the people at the gathering was supposed to text me the same thing but they didn’t. Im a covert narc so the victim mindset set in and the anger came through. This whole day i felt so numb but some emotions keep coming up but i can feel it being suppressed. Im suppressing it because i hurt these people and that its my fault and dont deserve to feel bad about it. Im gonna have to see all of them at school so great👍🏻,4
136,A friend called and needed some help....,64,j80u46,https://www.reddit.com/r/NPD/comments/j80u46/a_friend_called_and_needed_some_help/,8,1602256655.0,"weeks ago I read that people with NPD tend to try and personally help with a given problem: « You're moving to your new home, let me be there ». « Want to learn something new, let me teach you. » etc. It puts the person with NPD at the center of attention from both the target and bystanders. We even over do it in order add some self sacrificing sentiment to it i.e. Trying to finish work early to help, interrupting what we’re doing right now, etc.

yesterday, a friend called and said she could use some money following to something that happened. I immediately thought I'd buy her some groceries for her to last the week. The month even, planning to do it after finishing early from work and surprise her even. 

If you're not NPD, you must be surprised by that last statement. NPDd identify these scenarios on a constant basis, sometimes we create them for ourselves and burst in anger if denied. We select them based on a « attention received/effort to pull » ratio. It's a permanent condition, at least for me. **It's actually the whole crux of having an unhealthy relationship with one's ego.** 

It explains why we want to do things in an out-of-ordinary manner (like above), why we get easily bored (things need to be extraordinary and involve us), or procrastinate (if it takes 8h to deliver that presentation for just a « thank you » from my boss, I'll surely do it last minute). but if you're NPD or have traits, you probably knew all of that.

anyway, I finished work early, told her I'll be there in 5 but with no news from me, she went out til the next day. Which is when I decided to see if I can let go of all the garbage I had in mind.

Today I went over, gave her the amount of money she asked for. Told her to give back when she can and feels comfortable and I went back to work. Lasted a minute.

I think I made progress and even though I came here to brag, I felt I could share with you.

I tried to give myself a different kind of view and posture where I wouldn't get the attention I usually strive for and while I can feel down my brain somewhere the effect of not having gotten  my fix, it is outweighed by the feeling that I actively worked for my recovery.

Just wanted to share. Keep strong people.",64
137,Extreme case of covert narcissism?,12,i6t0w8,https://www.reddit.com/r/NPD/comments/i6t0w8/extreme_case_of_covert_narcissism/,39,1597013540.0,"I (22m) think BPD might be my main concern but I score insanely high on the Maladaptive Covert Narcissism Scale (MCNS).

My score was 104. The questions felt like a summary of my social life. If you’re interested, you can take the quick test here:

https://haplogroup.org/quizzes/maladaptive-covert-narcissism-scale-mcns/

I am not diagnosed with anything yet. However, I am seeing a psychiatrist for my severe anxiety, depression and catastrophic mood swings in a couple weeks.

Anyway, let’s dive in:

There is so much hate, shame, anger and contempt inside me. Sometimes, I fantasize of brutally murdering people because I am terrified of their judgment, or because I am jealous of their accomplishments. I can’t even describe the shame and pain I feel at the slightest hint of disapproval. I feel that those who inflict this kind of misery upon me deserve hell. When someone hurts me, I often smile back at them telling to myself that as soon as I am rich and powerful enough to be above the law, I will make them suffer, and make them regret the day they were born.

At the same time, I exhibit pathological levels of goodness towards others because I desperately want to be liked. I am very hesitant to disagree with people unless I think so little of their status that their opinion doesn’t matter to me.

I help my friends a lot, if only because I want to be liked (and because I like to brag with my high intelligence and make them feel stupid). In truth, I couldn’t care less about them or their issues. They don’t care about me, anyway. I am under no obligation to care about them. They should be worshipping the ground I walk on because I am vastly superior to them.

I put others down in order to feel powerful and gain a sense of control. I enjoy deceiving and manipulating people, even if most of my manipulations are quite basic.

Can you relate to that?

No? Don’t worry. Reading all this shit makes me feel insane, too. I am usually not very honest, not even to myself. I just censored some portions of this post because I find it too terrifying.",12
138,"Narcissists of Reddit, what is your everyday life like?",9,eybtcv,https://www.reddit.com/r/NPD/comments/eybtcv/narcissists_of_reddit_what_is_your_everyday_life/,15,1580756090.0,"Crosspost from r/AskReddit. What is your everyday life like? How do you interact with family, friends and partners? Is there anything that normal people do that you wish you could/ anything you think you are better at because of NPD?",9
139,Please help me. I don’t understand why I do this??,5,l0vow6,https://www.reddit.com/r/NPD/comments/l0vow6/please_help_me_i_dont_understand_why_i_do_this/,3,1611097384.0,"
Basically my mom is in a bad mood. She tells me to get off the communal family room blanket and pulls it even tho she’s not gonna use it. I looked in the groceries she brought home and she said “get out of there” and kinda kept trash talking me and my life. She’s been shaking my head at me just bc I stand up and shakes her head at anything I do. When the dog sits by me she says to the dog “you’re not gonna get any food from her” -basically the way she worded it and her tone showed me she was annoyed bc the dog sat by me and she doesn’t want me to feel like the dog likes me and feel happy. Basically she’s imaging me as evil in her mind and when the dog sits by me it probably bothers her bc than she can’t feel I’m as evil and she can’t think I feel like I’m this horrible human 

The truth is I’ve acted the same way with her. Every once in a while I’m just in such an annoyed mood by her bc I’m pretty sure she’s a narcissist and was abusive  growing up. I feel like she’s expressing she is disturbed  at me and trying show her emotions of anger/hate towards me. 

I don’t want to act like this though. Seeing her act like this makes me realize I’ve done it before. I’ve acted just like her when I’m in a bad mood forward her. I don’t think I have NPD but think I have fleas. What is the cause of me acting like this towards her. Is it a narc flea or a trouble handling emotions, anxiety, could it be adhd? I don’t wanna make someone feel like a dislikeable human and shake my head at rhem just Bc im annoyed at something they did. How can I not be like this? I’m basically trying to get a better understanding of why I do it bc I can’t change if I don’t understand why",5
