id,url,title,score,num_comments,created_utc,selftext
eiatnq,https://www.reddit.com/r/NPD/comments/eiatnq/was_anyone_else_diagnosed_with_odd_in_childhood/,Was anyone else diagnosed with ODD in childhood?,2,7,1577835950.0,"I was diagnosed with oppositional defiant disorder in childhood (i don’t even see how that’s a valid mental illness, I definitely think it’s just a precursor like conduct disorder is). Anyways was anyone else diagnosed with this and it ended up being NPD later on?"
ei1c9k,https://www.reddit.com/r/NPD/comments/ei1c9k/self_harm/,Self harm,0,1,1577789002.0,[removed]
ehzoj8,https://www.reddit.com/r/NPD/comments/ehzoj8/curbing_negativity_vs_cultivating_positivity/,Curbing Negativity vs. Cultivating Positivity,27,4,1577777226.0,"I wanted to expand on a point I made in my previous post, which discussed how people often talk about how they treated their ex like shit, how they lost their friends, and how they are working to prevent these toxic (negative) behavior patterns in the future. However, I rarely see people diagnose their own lack of positive behavior patterns as a problem, and I rarely see solutions for how to increase positive behavior. This imbalance should make us suspicious that we are overly focused on the our negative habits, rather than our lack of positive habits –– in fact, this squares with the typical narcissist profile, since it's a lot easier to get attention and feel sorry for yourself when bemoaning your own negative traits/destructive behavior patterns.

As a covert narc, I think that I have mistakenly overemphasized my negative (toxic) behavior patterns, when in reality, the bigger difference between me and the person I want to be may be found in my lack of positive behavior patterns. 

I am trying to take this one step at a time now. For example, even simple things like accepting a compliment for being caring/kind is challenging for me, and I usually have to soften the compliment under irony/cynicism or by making some exception for why it was OK for me to be kind in that moment. However, I feel that I am becoming more aware of this, and that even though I may instinctively shy away from these compliments, I am able to now consciously accept them. Hopefully, these habits will engrain themselves into my subconscious and strengthen my ability to be a force of positivity to those around me without feeling emotionally strained or disingenuous to myself."
ehrojw,https://www.reddit.com/r/NPD/comments/ehrojw/good_ways_to_get_narc_supply/,Good ways to get narc supply?,7,11,1577738047.0,"After high school I lost basically all of mine. I've been crashing a lot ever since then, and it's only been a few months since I actually got my diagnosis and started to make sense of everything that's happened. I've realized the reason I was doing better then was that I was the head of my AP class, with teachers constantly telling me I was oh so gifted and going to change the world and just a bunch of other bullshit. Now I don't have anything like that and it just really feels like my whole life was a lie or some shit.

That was pretty irrelevant. Basically, what are your sources of narc supply or do you have any ideas on how to get more of it? Thank you for reading."
ehpf2m,https://www.reddit.com/r/NPD/comments/ehpf2m/in_love_with_a_narc_and_having_trouble_decoding/,In love with a narc and having trouble “decoding” his behavior. He added me to a fake page that he doesn’t follow me on,0,2,1577728632.0,[deleted]
ehmol1,https://youtu.be/UmzHq4fs8h4,If this guy is correct then I guess were all doomed lol,1,0,1577716164.0,
ehj1rh,https://www.reddit.com/r/NPD/comments/ehj1rh/i_dont_know_that_most_of_us_here_are_here_because/,"I don’t know that most of us here, are here because we were not victims ourselves of some kind of narcissistic abuse/trauma.",10,12,1577691652.0,No one ever wants to talk about that part though. So I want to know. Who is (was) the narcissist is your life? The one that helped shape the budding narc you are today? For me it was my adoptive mother. She is the Queen narcissist whom I learned everything from.
ehijop,https://www.reddit.com/r/NPD/comments/ehijop/loving_ourselves/,Loving ourselves,21,19,1577688380.0,"All the posts I see here are about the behaviors people take with respect to others: how you treated an ex like shit, how you lost your friends, how you wish you could be empathetic.

But from what I've read, one theory explaining the root of NARC behavior is that we cannot love ourselves. As a result, we cannot form a stable sense of self independent of being above others. I rarely see people discuss this aspect of their personality. Do you think it drives your behavior? Do you think it's at the root of how you mistreat others? What steps are you taking to love yourself more?

I'm still ruminating over how this relates to me personally, but I'll probably post an edit in the morning."
ehicav,https://www.reddit.com/r/NPD/comments/ehicav/does_anyone_else_feel_this_way/,Does anyone else feel this way?,1,0,1577687105.0,[removed]
ehh6rs,https://www.reddit.com/r/NPD/comments/ehh6rs/i_often_find_that_i_hate_a_lot_of_my_friends/,I often find that I hate a lot of my friend’s boyfriends,1,0,1577680682.0,[deleted]
eh6tc8,https://www.reddit.com/r/NPD/comments/eh6tc8/diagnosis_vs_treating_symtoms/,Diagnosis vs treating symtoms,5,6,1577631627.0,"What is the benefit of a diagnosis vs just treating the symptoms? Backstory is my therapist would dx me NPD....if I told her why I thought it would be valuable. 

It is a weird position to be in. I've been going to her for over a year. 

I haven't been able to answer. I end up saying ""well I guess nothing matters anyway but if I am NPD I'd like it in writing.""

I have some pretty serious traits that pervade every aspect of my life and feel like I'm not getting anywhere. Not sure if a diagnosis is getting somewhere either though.

So how has being dxd helped you? Has it hurt you? What do you think of the treating symptoms vs diagnosing and treating symptoms debate?

I mean, if we aren't gonna dx personality disorders then we should just burn the DSM V already.

Not looking for people to diagnose me by the way. Just want something to discuss with my therapist surrounding whether or not I should or shouldn't be diagnosed."
eh4yc7,https://www.reddit.com/r/NPD/comments/eh4yc7/unintentional_gaslighting/,Unintentional gaslighting,11,15,1577618839.0,"I have seen many ""explanations"" about gaslighting from the so called ""victims"" point of view and they all sound the same.

What intrigued me is why I **never had any intention** of doing that, which they are accusing us actually of doing on purpose (like us being aware of it, planning it, etc...).

Then I realized that I created a rule in my life many years ago which solved many of my problems, it is: *Never promise anything to any partner.*

Why has this rule saved me? Because I actually do something which *looks like* gaslighting. My frame is rock solid and when I convincingly defend myself about forgetting a promise in the default way: like the promise never existed and you're making shit up (because that is what I actually believe at that moment and am convinced off 110% because it is me who is believing it) so you must be in the wrong.

After that, I remember many situations, when many days, even months later, something reminded me of me actually promising that thing...

Better to avoid getting into this situation in the first place."
eh4sw0,https://www.reddit.com/r/NPD/comments/eh4sw0/is_it_just_me/,Is it just me,3,5,1577617612.0,[deleted]
egyybm,https://www.reddit.com/r/NPD/comments/egyybm/a_vent/,A vent,24,22,1577580113.0,"I just need to vent. I've ruined a lot of relationships. Never felt very remorseful or empathetic. Well I've been doing a fuck ton of work and there is one ex in particular I kind of ran through the ringer. For years. Well I guess she finally got fed up because I reached out casually and she was like let's never speak again. I sort of don't know what happened between now and the last time we talked but I probably left her heartbroken.

I was jealous and insecure with her. She loved me to death and I couldn't come out from behind my masks. I couldn't see shit. Learning empathy aside from cognitive has expanded my perceptions. And makes me realize what an idiot I was. Definitely not perfect now but the level of motherfucker I was, was vile. 

God I've lost so many friends, relationships. Everyone, pretty much. And cut out my narc mom. What a brutal fucking year. This year marked me losing 3 very good friends, 2 of which I've been friends with for several years.

I was so much at the point of doubting my motives that I wondered if I should have even apologized to my ex or was I doing that narc thing I always do. I believe I meant it, but I always believe I mean it. Then again I've offered serious genuine apologies this year so maybe I'm getting better. I hope so. 

I'm at the point where I am typically happy alone and can modify my behavior although I have plenty of moments. Talk about a journey of a thousand steps. It's tiring. 

That's all, for now."
egt1za,https://www.reddit.com/r/NPD/comments/egt1za/does_anyone_else_here_have_kids_having_a_child_is/,Does anyone else here have kids? Having a child is super triggering for me. Over the holidays I became even more hyper aware of my behavior since I was around my mom. I realized that I lose my shit just like my mom did when my son makes small mistakes.,9,13,1577552294.0,This time it was spilling jelly on his pants. I find it hard to control these urges to snap. Has anyone been successful at controlling this or have techniques that have worked for a short fuse. I hate it and a determined not to make my son feel like my mom made us feel. Help!
egp7ip,https://www.reddit.com/r/NPD/comments/egp7ip/vulnerable_narcissism_and_self_esteem_issues_at/,vulnerable narcissism and self esteem issues at work over small things,0,1,1577528077.0,[deleted]
egfaro,https://www.reddit.com/r/NPD/comments/egfaro/anger/,Anger,0,0,1577473559.0,[removed]
egf1np,https://www.reddit.com/r/NPD/comments/egf1np/one_way_i_got_some_npd_symptoms_under_some/,One way I got some NPD symptoms under some limited control,4,1,1577472452.0,[deleted]
egdlc0,https://www.reddit.com/r/NPD/comments/egdlc0/you_ever_sometimes_wish_you_were_normal/,You ever sometimes wish you were normal?,23,18,1577465901.0,"I don’t know exactly why but sometimes when watching other people in public I’m amazed at their oblivious outlook on life compared to my own. It seems like despite their worries and issues in their life they still appear friendly and happy. They still buy stuff, talk to family, etc. They care about things and love people. 

As for me, I don’t. I’ve tried countless times but I lack the empathy needed to give a damn about someone else. People tell me about their problems or when they lose a family member and I just have to put on a sad face and try to exit the conversation as fast as I can. My mentality is that if it doesn’t apply to me or affect me in any way, it doesn’t matter. It sounds awful and it is but its the way I have been since I can remember. Heck, even as a child I viewed people as tools or cards to be used. I’m manipulating as heck. Another unfortunate thing is that I absolutely do not enjoy life. I don’t really have any hobbies I like, no passions, nothing. As someone put it, I  feel like I’m just watching my own life in a theater and bored out of my mind and just waiting for the end credits. It’s miserable but sometimes I don’t mind it though. That’s the weird part because despite all of my faults I still like myself sometimes. 

But yeah, back to my point. Sometimes I wish I was like other people though if I’m going to be here a while. Being this way is freeing but it comes with its own costs. Especially when you can’t change, only fake it. But then I realize other people are so easily hurt by life. They lose a loved one and sometimes their whole world can fall apart. At least I don’t have that problem. I generally don’t like people either, so my social circle is basically zero to none. But eh, just wondering if anyone feels the same."
eg90fv,https://www.reddit.com/r/NPD/comments/eg90fv/is_there_such_thing_as_a_narc_who_doesnt_mind/,Is there such thing as a Narc who doesn’t mind criticism?,1,0,1577438238.0,[removed]
eftenh,https://www.reddit.com/r/NPD/comments/eftenh/cant_accept_too_much_attention/,Can't accept too much attention?,13,22,1577351966.0,"So, I've been conflicted with this for a while. I obviously like affirmation, attention, compliments, etc. In my past I would say I went out of my way to make sure I had a steady flow of those things. However, I'm finding myself in a situation where I am overwhelmed by the amount I am getting from one person. It's usually in my nature to dip when I feel overwhelmed, but in this case I don't necessarily WANT to. I don't like an excessive amount of hugs and whatnot, I have always tended to have my bubble, and get kind of annoyed if it's intruded upon. I'm trying to be better about listening to other's needs because I know I'm not the easiest going person when it comes to emotional things. I just feel smothered and have voiced it several times. Pretty sure the person also has BPD, I know that NPD and BPD tend to attract, and I don't know if it's something I need to work on, or they need to work on. Have any of you experienced this? What do you do?"
efrhmw,https://www.reddit.com/r/NPD/comments/efrhmw/how_my_convert_narcissist_wife_cruelly_discarded/,How my convert Narcissist Wife Cruelly discarded me: stages of covert narcissism,0,5,1577338683.0,[removed]
efi403,https://www.reddit.com/r/NPD/comments/efi403/how_to_deal_with_splitting/,How to deal with splitting?,6,3,1577289827.0,[deleted]
efh4rm,https://www.reddit.com/r/NPD/comments/efh4rm/happy_holidays/,Happy holidays,24,12,1577284508.0,"For anyone who feels alone today or just needs to hear it happy holidays :) you deserve to be happy today and enjoy yourself, and I hope you do. Stay strong everyone, NPD shouldn’t ruin Christmas for us."
eeuhw1,https://www.reddit.com/r/NPD/comments/eeuhw1/fantasizing_about_power_and_success_for_a/,fantasizing about power and success for a particular reason,9,4,1577153300.0,"I find myself spacing out or zoning out often, it's mostly me fantasizing or daydreaming about success and power, whether if it's getting a PhD, 6 figures salary, high social status, reputation, etc. And I believe the major reason as to why I would want such a goal is so that I can smash it in everyone's face about just how much better I am than them, just how much superior I am to them, and they can't ever question me, look down on me, or condescend me ever, but I can do that and be as arrogant as I want to with solid evidence to back up my arrogance, so the only thing that they can criticize me for is my shitty personality, which to be honest with you, I don't care about, because I've been displaying a good personality my whole life, but it seems to me that it holds 0 value, and are often taken advantage of, as they say, these good, angelic, empathetic personalities are often preyed on and toyed by predators. I believe this mindset stem from childhood of being constantly condescended by others, constantly regarded as a weak, sensitive, dumb, and a failure, usually by peers, parents, maybe even teachers, and were easily toyed around by sadists.

These goals, if they are ever accomplished, will make me feel protected, it will fulfill my ego, wraps it around with fortified steel walls. Anyone else can relate?"
eesd94,https://www.reddit.com/r/NPD/comments/eesd94/were_you_goaded_by_teachers_etc/,Were you goaded by teachers etc?,15,18,1577143149.0,"I got curious about this because apparently a handful of posters here have said they were treated as gifted, proclaimed smart, etcetera by teachers and/or people in general in their childhood. [Sam Vaknin released a somewhat watchable clip on this.](https://youtu.be/W89fG8220D8) 

Well, I got the whole package. Teachers flattered me in general (with one female particularly harrassing me to write something and comparing me with a ""disoriented sage in a child's body), classmates even years later would comment how *oh I write soo well* upon me commenting dreams of publishing a book, and several shrinks bought into my projected *desired self* and recognized me verbatim as ""brilliant"", ""a great conversationalist"" and so on. 

Granted, *I am all of those things* lol, but all this supply coupled with childhood sexual abuse basically made me unable to care about other's people opinions and led to disastrous decisions in my 20's with the anhedonia/apathy that ensued and that makes ""being interesting"", ""oohh soo deep"" and gifted verbally completely joyless and null. I kinda feel that at the end of the road all this book reading and effort to understand stuff has been investing in a character that doesn't make me happy. Society is brainless anyway, being a thinker is social masochism. 

And all this time, while engrossed in intellectuality, I was ignoring the elephant in the room: I have a self esteem, self-image, affection disorder that prevents succesful, wholesome relationships with people."
eektqm,https://www.reddit.com/r/NPD/comments/eektqm/how_do_people_remember_themselves_as_a_child/,How do people remember themselves as a child?,10,10,1577108956.0,Just wondering when people see their narcissistic traits first starting to show?
eekpqt,https://www.reddit.com/r/NPD/comments/eekpqt/i_feel_like_a_piece_of_shit_that_deserves_to_die/,I feel like a piece of shit that deserves to die,9,9,1577108323.0,"Since I was a teenager, my life's been hell due to my dysfunctional behaviours and thinking.  I've caused so much stress and unhappiness to my mother.  I tried to blame others for my situation, including my parents but I don't feel able to do that anymore.

Has anyone else been through this kind of self-loathing while trying to change?"
eeixru,https://www.reddit.com/r/NPD/comments/eeixru/can_narcissists_know_they_are_narcissists_before/,Can Narcissists know they are Narcissists before their diagnosis?,4,13,1577096837.0,
eegaa3,https://www.reddit.com/r/NPD/comments/eegaa3/npd_and_social_media/,NPD and social media,6,4,1577079517.0,[deleted]
ee8n6e,https://www.reddit.com/r/NPD/comments/ee8n6e/polling_on_a_removal_rule_mods/,Polling on a removal rule - Mods,6,2,1577040900.0,"Hello everyone, please take the poll linked below. We want to hear what everyone thinks of us removing posts by users asking for a diagnosis. What we mean by this is users describing symptoms and asking if they have NPD, asking if they are a narcissist, or asking for a diagnosis of any kind. This has been recurring quite a bit recently and we aren’t sure if we should count it as spam/harmful. Unprofessional diagnosing is discouraged, but we want to know if you see this as a problem or as helping someone differentiate their symptoms from NPD. We’ll decide sometime this week depending on how close the votes are and how many there are. Please vote only once. Thank you.

http://www.strawpoll.me/19120061"
ee5fd4,https://www.reddit.com/r/NPD/comments/ee5fd4/mod_reminder/,Mod Reminder:,12,7,1577024825.0,"We will be working on official rules shortly, however for the time being the rules that we do have in place (pinned) are not being followed. Non-NPD individuals **cannot** post but are allowed to comment and discuss **respectfully**. If it is rude, spam, or harassing in any way it will be removed. Same goes for NPDs who comment. Posts asking for a diagnosis have also been a problem, those will be removed. Questions from Non-NPDs for people with NPD can be directed to a similar subreddit, r/AskNPD. Repeated offenders or obvious trolls will be banned. Again we will be working on official rules soon, but if you see anyone breaking these rules we have now please report. Thank you."
ee3rnr,https://www.reddit.com/r/NPD/comments/ee3rnr/do_you_find_yourself_mistrusting_confidence/,Do you find yourself mistrusting confidence?,4,5,1577012702.0,"My partner and I have been apart now for just a couple of days, just the beginning of a long separation that won't end until the end of January at the earliest.  In the past, separation has been a big trigger for me, leading to feelings of despondency, loneliness, anger and eventually withdrawal.  

Perhaps because I'm more prepared (mentally and emotionally) for this particular stretch of separation than I have been in the past, I feel strong.  I feel confident in my ability to control my narcissism and in my ability to prove to my partner that earning her trust is important to me.

And my first thought is to be suspicious of that confidence.  

One of the things I truly hate about NPD is coming to the realization that you cannot trust your own emotions and reactions, and therefore I end up second guessing any extreme emotion that I experience.  Should you feel confident about this?  Should you REALLY?  Does it mean you're taking things for granted, falling asleep at your post?  Is it going to make you even more likely to lose control when emotions run high?

I hate asking myself those questions, they make me feel tired and angry.  I want to just...BE CONFIDENT, BE HAPPY...except I know that just happily going along with the good times means I'm less prepared for the bad, and that means explosion.

My partner pointed out to me not too long ago that I should be planning for the bad with every bit as much gusto as enjoying the good...I guess I'm still learning that.

Do you ever really trust yourself enough to be confident?"
ee3h0l,https://www.reddit.com/r/NPD/comments/ee3h0l/what_is_the_difference_between_npd_and_someone/,What is the difference between NPD and someone being arrogant?,2,7,1577010158.0,[removed]
ee2go4,https://www.reddit.com/r/NPD/comments/ee2go4/in_response_to_that_person_who_said_i_deserve/,In response to that person who said I deserve death,0,0,1577001688.0,[deleted]
edyaag,https://www.reddit.com/r/NPD/comments/edyaag/sorry/,Sorry,1,45,1576977000.0,[deleted]
edxr5w,https://www.reddit.com/r/NPD/comments/edxr5w/do_you_have_npd/,Do you have NPD?,0,33,1576974276.0,[deleted]
edr9cj,https://www.reddit.com/r/NPD/comments/edr9cj/questions_for_the_covert_narcassists/,Questions for the covert Narcassists,12,22,1576942691.0,[deleted]
edqhcr,https://www.reddit.com/r/NPD/comments/edqhcr/covert_contempt/,Covert contempt,1,0,1576938391.0,[deleted]
edqfki,https://www.reddit.com/r/NPD/comments/edqfki/dae_get_upsetangry_during_therapy/,DAE get upset/angry during therapy?,6,9,1576938098.0,"I swear I become nearly hysterical in therapy way too often. Probably because I’m being challenged for the things I say and do, and they’re trying to figure me out when they can’t. They aren’t like me so they wouldn’t understand. Going to therapy is like prodding my ego myself, and it really hurts. Whenever she points out that I’m actually really fragile I get so irrationally upset about it, even if it’s true. Facing some of the realities is very difficult. Does anyone else get this way? I feel like this is why so many of us drop out of therapy unexpectedly or why a lot of us don’t even start. I’m ready to quit at this point, I think I could do just fine on my own."
edoy35,https://www.reddit.com/r/NPD/comments/edoy35/anger/,Anger,4,2,1576927946.0,[deleted]
ednrer,https://www.reddit.com/r/NPD/comments/ednrer/how_do_you_know_you_have_npd/,How do you know you have NPD?,10,22,1576918739.0,"Hey guys,

Its so cool that there is a sub reddit for people with NPD. It's a wonderful opertunity to get your perspective on things. 

I was wondering how you become certain you have NPD? As in how does NPD manifest in your life?

Feel free to share both external behavior and internal thought and feeling patterns.

I grew up with NPD parents who doesn't seem to be aware that they have NPD. 
I also have a slight fear that I may have NPD. I have had certain delusions of grandeur in the past, lack of responsibility and entitlement but those traits have luckily diminished over time. The more time spent away from my parents, the more of the NPD traits I can see in myself appear to diminish. 

They say you're the average of the 5 people you spend the most time with, so it's not unreasonable to develop a little extra narsissism after all."
edj2zt,https://www.reddit.com/r/NPD/comments/edj2zt/one_week_with_cbd_oil/,One week with CBD oil,10,13,1576890650.0,"So far its been pretty helpful with reducing me irritability which means I am

Less reactive therefore
More thoughtful slowly
More reflective leading to
More vulnerable and sloooooowly to
More empathetic

Reducing the tension i feel so consistently (to the point that it feels normal and confortable) is helping.

Of course I alresdy noticed In more on edge some days than others so add a bit. (i do not use THC as there is a history of a LOT of mental illness including dementia, psychosis, anxiety and suicide.)

Have you tried CBD to help manage your NPD symptoms? How has it been?"
edgmfl,https://www.reddit.com/r/NPD/comments/edgmfl/no_longer_diagnosed/,No longer diagnosed,1,6,1576878559.0,[deleted]
edeh6t,https://www.reddit.com/r/NPD/comments/edeh6t/why_do_symptoms_become_worse_around_holidays/,Why do symptoms become worse around holidays?,5,2,1576868835.0,[deleted]
ededvr,https://www.google.com/amp/s/www.psychologytoday.com/gb/blog/the-mysteries-love/201912/what-lies-beneath-the-veneer-narcissism%3famp,Interesting article. I'll post some of my thoughts later.,5,4,1576868435.0,
ed8kmo,https://www.reddit.com/r/NPD/comments/ed8kmo/is_it_possible_for_a_narcissist_to_not_be_insecure/,Is it possible for a narcissist to not be insecure?,2,12,1576838720.0,
