id,url,title,score,num_comments,created_utc,selftext
ed7u74,https://www.reddit.com/r/NPD/comments/ed7u74/full_shut_down/,Full Shut Down,18,13,1576833495.0,"I found myself a little while ago giving someone advice about dealing with their NPD and once I was finished realized...am I really in any position to give advice?

Days ago, less than a week, I had my worst moment.  Something small happened, something that with a minimum of effort on my part could have dissipated, could have turned into an opportunity to show my narcissism who's boss...instead, I shut down immediately, completely.  I allowed myself to feel nothing, and I devastated my partner.

Over....nothing.  Over a stupid drunken outburst that, had I just recognized and taken responsibility for...

God.  The Hallmark of the Narcissist: Realizing too late how stupid you were being.  The image I most associate with NPD is me with my palm on my face.  Stupid, stupid, stupid.

So much damage done, so much a TINY bit of empathy could have fixed...so much that the love that I feel for my partner could have saved, had I only listened to it instead of just closing all my mental doors and locking them.  If I hadn't just shut down and gone into whatever kind of self preservation mechanism that means pushing everyone and everything away from me, I could have gained ground instead of losing it.

I almost lost her.  Entirely.  

I cannot let up.  I cannot take my finger off the switch.

I do not trust my reactions.

I cannot give up.  

I guess I'm just needing to tell people about it that hopefully understand, that will tell me that it will not always be one step forward and fifty steps back.

Thanks for listening"
ed1eq3,https://www.reddit.com/r/NPD/comments/ed1eq3/how_to_tell_a_friend_theyre_a_narcissist_without/,How to tell a friend they're a narcissist (without hurting their feelings)?,2,3,1576798100.0,[removed]
ecuyej,https://www.reddit.com/r/NPD/comments/ecuyej/seeking_help_in_dealing_with_my_inability_to/,Seeking help in dealing with my inability to function properly.,10,10,1576770463.0,"I am 24 years old and am in a relationship for just over four years now. At the start if Novembre, I saw a psychologist who softly diagnosed me with Borderline Personality Disorder and Narcissistic Personality Disorder. At the start of january, I will be staying at a psychiatric ward for an extended period of time.
But I want to learn to see my faults before I do them.
I am a compulsive liar, I can't really do anything for anyone else but me.
I seem to fabricate memories or just erase those that don't benefit me. I tend to disagree with everyone instinctually.
And only when my partner tells me all that to my face and after a lengthy discussion, I break down to my ""wanted self"". I see my mistakes, I can acknowledge them. I agree with my partner and try to make them believe me.
But with all my lying I did, with all the cheating and manipulating I did, they can't believe me. And worst of all: most often, I fall back into old habits, thereby completely invalidating my ""epiphany"". Rinse and repeat, until the next time I fuck up so hard, and me and my partner have the same discussions over and over again.

I really want to always be that person I am after I break down. Always want to be able to appreciate others, my partner at the forefront. I want to be able to know when I am going to lie, and actually be able to see them as that. At the moment, I am in that ""wanted self"" state. I am aware of my mistakes and try to correct my behaviors. But even then, I tend to fall back into old habits. Lying, forgetting, and straight out refusing to believe others.

I know, there is a way out of this. But I can't seem to find it myself. What are ways you managed to change all that? Please help me."
ecphhq,https://www.reddit.com/r/NPD/comments/ecphhq/overcoming_narcissism_through_the_framework_of/,Overcoming Narcissism through the Framework of Grief,31,11,1576737592.0,"I want to propose a new framework for how to think about narcissism and narcissism recovery: the framework of loss. Lately, I've seen a lot of posts (most recently from /u/anodyne123 and /u/evilbutlovingit) talking about the shame they feel due to being a narcissist. The typical narrative goes as follows: you know how much pain you are causing to others and yourself, and in moments of clarity, you feel a visceral remorse for being the source of all that pain. But once you go back to normal life, you invariably revert to your old ways, causing a cycle of self-hatred and despair. To quote: 

>I’m sorry. I’m really fucking sorry and it’s just not just a ploy for attention. If I had the nerve, I’d do what I should’ve years ago and spare you all from my bullshit. I don’t know how when I can’t get outside my head. So I’m sorry for that.

Grief is usually associated with the loss of someone so close to you that you know that losing them will irreparably change your life. Usually, it has to do with the fact that a core part of your identity was shaped by and contingent upon your interactions with them. When you grieve, you grieve not just losing a person, but also losing the part of yourself connected to that person: an identity loss. We grieve deaths but also less significant losses, like breakups or divorces. A particular characteristic of grief is the black-and-white nature of it: you often feel the need to valorize or villainize the person you are grieving.

In a similar vein, recovering from narcissism involves either minimizing or completely annihilating a part of ourselves. In many ways, this loss is greater than the identity loss from grief. After all, our narcissistic persona may be the deepest part of our identity. It is the basis of our humor, our social patterns, and our worldview. It might be the part of ourselves that our friends, associates, and acquaintances like. It may even be the part of us that they like *most*. And parting ways with that is going to hurt, no matter how you cut it.

I have found this framework helpful for bridging the gap between my moments of ""clarity"" and the mundane day-to-day, where I often find myself reverting to old patterns of behavior. Reverting to these patterns is like texting an ex, or revisiting your parents' home: it slows down the grieving process. But that doesn't mean that overcoming these patterns is happy or fun. It will feel sad, just like when you part ways with an ex. On the road to recovery, you will miss your narcissistic self. But that doesn't mean you're failing –– it means your grieving, and moving on."
ecp6ae,https://www.reddit.com/r/NPD/comments/ecp6ae/lots_of_guilt_and_shame/,Lots of guilt and shame.,6,0,1576735726.0,[deleted]
eciuym,https://www.reddit.com/r/NPD/comments/eciuym/is_this_what_its_like_between_neurotypicalspeople/,Is this what it’s like between neurotypicals/people without npd?,0,0,1576704186.0,[deleted]
ech4pc,https://www.reddit.com/r/NPD/comments/ech4pc/discord_server_for_narcissistic_individuals/,Discord server for narcissistic individuals,1,0,1576696710.0,"A place for NPD, suspected NPD, and high narcissistic trait individuals to talk and connect with each other through experiences and discussion. Read the rules and introduce yourself first and then feel free to participate. Hope this works well. 
[NPD Chat Discord Server](https://discord.gg/Aw3mwTb)"
ecga15,https://www.reddit.com/r/NPD/comments/ecga15/what_are_your_favorite_movies/,What are your favorite movies?,1,15,1576692901.0,"I came to the conclusion that two of my favorite movies both feature narcissistic characters in main roles. Do any of you relate? Either way, what movies are your favorite and why?"
ecbpit,https://www.reddit.com/r/NPD/comments/ecbpit/im_sorry/,I’m sorry,43,7,1576670529.0,"Everyone who’s ever genuinely cared about me I’ve driven away. They might love me, but I’m not sure if I love them. I wish I did, but that’s not good enough.

I don’t know my own mom’s birthday. I do know the birthday of every ex who’s ever rejected me. I’m such a self-absorbed piece of shit. How have I been alive for 23 years and I still don’t know her birthday? How is that even possible? I’m so sorry, from the bottom of my heart. It’s not often I feel this kind of remorse, but right now I do and it’s overwhelming.

I just want to be liked, and it’s disgusting. Of course people run away the second my switch flips and I turn into a self-destructive, apocalyptic turd of a human being. I would do anything to live in this stupid little bubble where everyone adores me. What’s even the point? If life has no challenge, no adversity, why live? But I’m too scared of criticism.

No one is good enough for me, which is so ironic. All I do is waste time.

When I’m (fairly) cut off, I try to be some spiteful, evil caricature of myself who gets the last laugh. Of course I never see it through—I need to be liked. In a way, it’d be better if I did. At least I’d be consistent.

Annoying is the best word to describe me. 

I’m sorry. I’m really fucking sorry and it’s just not just a ploy for attention. If I had the nerve, I’d do what I should’ve years ago and spare you all from my bullshit. I don’t know how when I can’t get outside my head. So I’m sorry for that.

I’m sorry I lie so much.

I’m sorry I laugh when I shouldn’t.

I’m sorry I write stupid shit like this.

I’m sorry I obsess and act weird.

I’m sorry I talk about the same 3-5 topics endlessly and still know so little about them.

I’m sorry I choose to be this way, really and truly."
ebzswv,https://www.reddit.com/r/NPD/comments/ebzswv/any_others_here_with_both_npd_and_a_history_of/,Any others here with both NPD and a history of addiction?,9,7,1576607744.0,"I'm not diagnosed with NPD but my extreme reaction to addiction therapy makes me sure that I have it.

I'm really struggling with immense feelings of shame and struggling to accept responsibility.  Was just hoping to try to connect with someone who's been through similar struggles."
ebxbh8,https://www.reddit.com/r/NPD/comments/ebxbh8/overwhelming_desire_to_be_the_center_of_attention/,Overwhelming desire to be the center of attention always,14,8,1576596992.0,"I'm very aware of all my narcissistic tendencies, but my biggest trigger is being in a room and not immediately being everyone's object of envy and desire. How do I get rid of my obsession with self ? I don't know what to do and absolutely no therapy seems to help. In my mind I'm simultaneously the prettiest and the most unattractive female ever. I realise the superiority complex comes from a place of deep insecurity, but I want to be better. I want to end this internal struggle of making everything into a competition and just live, without subjecting myself to a state of constant competition nobody signed up for"
ebt0aj,https://www.reddit.com/r/NPD/comments/ebt0aj/pretending/,Pretending,9,12,1576570140.0,"If I'm myself, no one wants to be around me, (Which is understandable.)    
If I try to be better, it feels like I'm pretending, rather than improving.    

Maybe the solution, is to not ""pretend"" when I'm completely alone, (So I don't hurt someone.)    
But DO pretend when I'm around other people, because, while pretending is uncomfortable, it makes me happier seeing other people happier. (Because as a result people are usually nicer to me. Which I guess sort of feeds that narcissistic addiction to attention and approval.)    

However, this would probably mean I should avoid making a family, or move in with someone I like. As that would mean they'd be around me constantly, so my true nature becomes more apparent, I wouldn't be able to ""pretend"" ALL the time. And I'd end up hurting the people I love.    
So for the best possible outcome, and for the safety of others, friends and family should live separately. This ensures I have all the privacy I need to full express myself, and also build up enough energy to ""pretend"" empathy later when I'm in public."
ebqo4v,https://www.reddit.com/r/NPD/comments/ebqo4v/what_do_people_think_about_creating_a_stickied/,What do people think about creating a stickied 'Resources' post?,10,6,1576555886.0,"The post could link to resources for healing, explanations of NPD, and so on. The reason I have this idea is that it feels like most people here are interested in healing, but the subreddit isn't necessarily engineered to be most conducive to that.

Another idea could be to have a weekly post to help create a sense of community, with everyone geared towards healing. One possible title could be:

* ""Weekly narcissism support thread: How has your narcissism been this week? ""

If other people have more ideas, please post below."
ebmam1,http://healingmynarcissism.home.blog,My new blog on Healing my Narcissism,8,15,1576535211.0,
ebg21k,https://www.reddit.com/r/NPD/comments/ebg21k/help_with_someone_with_npd/,Help with someone with NPD.,1,2,1576507781.0,[removed]
ebeodn,https://www.reddit.com/r/NPD/comments/ebeodn/having_a_great_christmas/,Having a great Christmas,11,4,1576500203.0,"My partner has told me that he needs to have a backup plan of what I will do if I NPD out at Christmas. If there is no plan, he will not be here at Christmas. This is a reasonable boundary considering my record of behavioir. We are having a dinner here, as well as another on another day with his family

(Note: my partner would rather be here and rather that I am not an asshole NPDing out. He would rather a great Christmas for everyone)

So I am working on the backup plan of what I will do if I NPD out over the holidays. I am wondering if you may also have a plan like this?

What I am including so far to prevent an episode
1) in a framework of sharing, actively including things at Christmas dinner that are part of my tradition so that I feel included and more at peace (food, music etc) 
2) taking breaks (without it being overly obvious) to gather myself through meditation and quiet reflection
3) ...

If i lose control, I will apologize and remove myself from the situation. If my negative thoughts swirl and i do not stop them and I am on the attack, i will apologize and go for a walk.

I am in need of a plan if I go over the top and my negativity and defensiveness destroys everyones holiday. I worry about leaving to a hotel alone or the like as other peoples holiday will alreadt be ruined. 

I am mostly brainstorming here but would really appreciate any ideas, tips, critiques around how to deal with the holidays and NPD freakouts."
eb3td7,https://www.reddit.com/r/NPD/comments/eb3td7/friendships/,Friendships,2,3,1576440183.0,[deleted]
eb26gi,https://www.reddit.com/r/NPD/comments/eb26gi/narcissism_and_ideal_love/,Narcissism and Ideal Love,18,35,1576432912.0,"Anyone else here have that clinging onto the notion of ideal love? I had one relationship I return to in my head as being the example of the perfect, classic relationship that I measure all experiences up against. Looking back it was volatile and difficult but ultimately he was patient, caring, empathic, and took care of me when I was a mess and nobody else would. My mum has full blown NPD (I have tendencies and a diagnosis of ASPD) and she fully obsesses for years about love she's lost. Her and her ex broke up two years ago and it's still all she can talk about, and the relationship wasn't even that great and she went out of her way to play as many games as possible with the person, but after they broke up she obsesses and tells the same anecdotes about their perfect romance. Before him, she had a partner that she spent 22 whole years never shutting up about. How common is this? Like I say, I had a similar fixation on my ex (although it ended differently as he has passed away and i've developed Complex Persistent Bereavement Disorder bc of it, but I wonder if the narcissism was part of the development of that disorder? An inability to let go of the idea that somebody did once love me for who I am?).

Sorry for the long post"
ear0q5,https://www.reddit.com/r/NPD/comments/ear0q5/how_to_have_a_thicker_skin/,How to have a thicker skin,6,3,1576365641.0,"Not sure whether that’s really the correct term. Anyway, I was with some friends the other night and I made a completely innocent remark asking two of them who had tension to ease up a bit. Got a bit of a bad reaction from one of them. The whole night was ruined. Just sat their simmering with rage that appeared outwardly as sulkiness and dismissiveness. The anger was so intense and made worse by the fact I had to internalize a lot of it. In these times I can barely keep a coherent thought and act on instinct / without really thinking.
How do you simply brush these things off??"
ead2cj,https://www.reddit.com/r/NPD/comments/ead2cj/medications/,Medications??,3,3,1576285965.0,I know there's no official labelled medication for NPD but I want to know if some medications help you feel better?
ea9m5x,https://www.reddit.com/r/NPD/comments/ea9m5x/howwhen_do_you_tell_someone_youre_dating_that_you/,How/when do you tell someone you’re dating that you have NPD?,2,18,1576269979.0,[deleted]
e9x6w3,https://www.reddit.com/r/NPD/comments/e9x6w3/what_exactly_is_an_emotional_connection/,What exactly is an emotional connection?,15,12,1576201561.0,"Who else struggles to put their finger on what this is, or what it feels like with others?

If all my friends and co-workers ceased to exist tomorrow I’m not sure I would be that disturbed, yet a lot of these people I actually like (apart from when they’ve done something wrong). Anyone else get this? I can ‘connect’ to people in some way when I’m with him but I’m not sure I would describe it as an emotional connection.

Plus does anyone find it harder to maintain such connections when they are alone? When alone, the feelings of coldness and detachment are much more pronounced for me personally.

Maybe I’m just over thinking things but I can’t shake the feeling that everything in life is just so underwhelming. There must be something more, something totally and utterly fulfilling. Something that takes me beyond humanity. Life, with its relationships and everything else doesn’t fill the void."
e9whum,https://i.redd.it/fjofkrbjsa441.jpg,Challenges in the Treatment of NPD,28,9,1576198052.0,[deleted]
e9s7ff,https://www.reddit.com/r/NPD/comments/e9s7ff/has_anyone_on_here_been_abused/,Has anyone on here been abused?,6,13,1576178567.0,[deleted]
e9s2mj,https://www.reddit.com/r/NPD/comments/e9s2mj/does_anyone_else_feel_like_not_caring_about/,Does anyone else feel like not caring about people and not having empathy just makes you superior coz caring about others just holds ppl back and your held back like that,16,14,1576177991.0,[removed]
e9ozja,https://www.reddit.com/r/NPD/comments/e9ozja/can_anyone_offer_insight_please/,Can anyone offer insight please?,7,5,1576164438.0,[deleted]
e9ne94,https://www.reddit.com/r/NPD/comments/e9ne94/why_not_being_perfect_is_correct/,Why not being perfect is correct ?,2,4,1576156449.0,[deleted]
e9md4t,https://www.reddit.com/r/NPD/comments/e9md4t/please_read_you_perfect_imperfection/,Please read you perfect imperfection,13,2,1576149877.0,"There is a book my therapist put me onto called the Drama of the Gifted Child. If nothing else, itll help you understand how your narcissism was a self-created coping mechanism for reasons you could never have controlled, and should put you on a path towards getting back to being just a normal human being. It has done so for me.

I think. Probably. Anyways, keep going. The happiest you'll be is when you give up ideal and just embrace okay."
e9jhsi,https://www.reddit.com/r/NPD/comments/e9jhsi/i_like_trump/,I like Trump,0,2,1576129668.0,"We have a lot in common.  


[https://www.youtube.com/watch?v=YA631bMT9g8](https://www.youtube.com/watch?v=YA631bMT9g8)"
e9gbyo,https://www.reddit.com/r/NPD/comments/e9gbyo/what_are_some_recurrent_npd_thoughts_yall_have/,What are some recurrent NPD thoughts y’all have and recognize that they’re narcissistic???,21,25,1576112471.0,[deleted]
e9en5k,https://www.reddit.com/r/NPD/comments/e9en5k/does_anyone_else_feel_like_a_scourge_on_society/,Does anyone else feel like a scourge on society,4,7,1576104505.0,[deleted]
e9duse,https://www.reddit.com/r/NPD/comments/e9duse/exhibited_symptoms_of_narcissism_myself_then/,Exhibited symptoms of Narcissism myself then realized,1,11,1576101153.0,After breaking up with the most ultimate selfish empty person in my life 3 years ago. I was exhibiting symptoms of emptiness and selfishness finally realized i had developed a lense which i see through the world where everyone could be a narcissist then paradoxically through that lense i realized i was only able to see myself which in turn transformed me into a narcissist. Always wondered why do i kept behaving like that person. I once read they are mythological vampires(if ure bitten by one u become one) and i finally do see why. All these support groups are basically factories of those lenses.
e9abxk,https://www.reddit.com/r/NPD/comments/e9abxk/just_got_diagnosed/,Just got diagnosed,0,11,1576086339.0,[removed]
e96ubv,https://www.reddit.com/r/NPD/comments/e96ubv/the_funny_thing_is_that_i_know_deep_down_im_very/,The funny thing is that I know deep down I'm very insecure,25,6,1576069436.0,"exposure therapy attempt 

took me a while to press ""Post"" but there it is"
e96htw,https://www.reddit.com/r/NPD/comments/e96htw/my_nonofficial_diagnosis_makes_everything_worse/,My non-official diagnosis makes everything worse,8,4,1576067363.0,[deleted]
e94hxo,/r/personalitydisorders/comments/e94aae/controversial_theory_for_cluster_b_can_any_other/,Controversial Theory for Cluster B. Can any other clusters relate at all?,1,0,1576053278.0,
e8yqx4,https://www.reddit.com/r/NPD/comments/e8yqx4/could_narcissism_be_the_root_cause_of_social/,Could narcissism be the root cause of social anxiety?,3,14,1576020917.0,"[after watching this video](https://www.youtube.com/watch?v=xjddU8EGdzM&feature=share)

I think specifically vulnerable narcissism, I felt so oddly relatable, and the comments were literally dead on about what is happening there, so accurate that it felt like they were describing me. All those times in school struggling to fit in and the fear of how others perceive me, struggling to hold a conversation and struggles to contribute and properly cooperate in a group work setting, it seems like it all comes back to narcissism (vulnerable narcissism). What is happening in that video of the guy is literally what happens to me when I am placed in the same kind of group talk setting, and that guy is a known narc."
