id,url,title,score,num_comments,created_utc,selftext
e8v4q4,https://www.reddit.com/r/NPD/comments/e8v4q4/im_worried_i_might_be_a_covert_narcissist/,I’m worried I might be a covert narcissist,14,2,1576005185.0,"But I’m not sure. I’m constantly trying to manipulate people, situations, because my sense of self is very fragile and I just can’t take criticism. Thought to be fair a certain family member is an asshole and probably a narc themself and their manipulation, gaslighting, and harsh words grate on me day after day, year after year so by now I’m expecting it constantly so I’m trying to manipulate people in order to avoid that perceived criticism and punishment. Which is what narcs do don’t they? To protect their poor wittle fragile ego. In class once the teacher was giving everyone a talk about something they were doing that they shouldn’t have been and even though I knew didn’t even apply to me and got upset anyway because I irrationally felt like I was being “attacked.” And I don’t really know who I am because I feel like I’m just trying to change to the situation like a chameleon (and failing horribly due to lack of social skills and social anxiety/awkwardness)

And when someone insults me it makes me boil with rage because in my mind I’m the greatest person ever and always justified whilst simultaneously knowing that’s not always true, which is hard to explain? Even if someone tells me a lighthearted joke that’s kind of deprecating I feel attacked even if it was just a joke like *points some sort of monster from a horror show * “hey looks like you!” 

Im not sure if I like the few friends I have or I just like that they’re nice to me. I hate that I’m questioning this but I truly don’t know. 

This whole post I’ve been trying to somewhat steer your answer to “aw hun you’re not a narcissist you just have fleas! Poor thing a good therapist can help you blah blah blah hang in there... and I didn’t even fully realize it till I was about to hit post and thought wait.

At the same time I was trying to cover all ground possible because I do this thing where I have to make it sound as bad as possible as to not leave any uncertainty so that if I get the answer I mentioned above then I can relax like “oh I didn’t forget to leave anything out and even with worse case scenario they still said “____” so I must be fine.” Of course whatever answer you give me I’ll never be satisfied and try to convince you of the other.

And of course no one can answer me anyway because they’re not a mental health professional.

This whole post was made as a reassurance shtick. 

Fuck.


Edit: I’m also extremely passive aggressive to the point of going the other way of being nice to people who were rude to me for the sole purpose of making them feel like shit for being rude in the first place. I once literally gave $200 and wrote an apology letter to someone who was a total asshole to me for no reason. Though part of me also saw that they were poor and I feel like part of me did actually want to help. But I was also mad and wanted them to feel horrible for being mean to “”””such a nice person”””” (which I’m not but what they did *was* actually unjustified and out of nowhere)

Edit 2: When I still had a counsellor I tried to bring it up with her and she straight up dismissed my concerns she says there’s no way I’m a narc blah blah blah and that’s when I realized thats probably because of my bullshit nice act. 

Edit 3: Also I have no idea if I’m acting or genuine unless I stop and really think about it, it’s all just ingrained."
e8qyhp,https://www.reddit.com/r/NPD/comments/e8qyhp/experiences_with_drug_use/,Experiences with drug use?,2,10,1575986462.0,Tell me about any of your trips and how they affected you
e8prx6,https://www.reddit.com/r/NPD/comments/e8prx6/what_trivial_lies_have_you_told/,What trivial lies have you told?,7,12,1575979541.0,"Those with NPD (and sometimes ASPD) are typically known to be able to lie about anything, even if the lie provides no significant benefit to them. What examples of this can you think of in yourself?

For example, I pretend that I need reading glasses because I like how they look. I’m not even trying to appear more intelligent because I am already considered intelligent and high-achieving by peers and professors alike. However, I keep up the lie that I need them to read (for some reason)."
e8l8os,https://www.reddit.com/r/NPD/comments/e8l8os/am_i_the_only_one_paranoid_about_this/,am I the only one paranoid about this?,4,3,1575949650.0,"I think I'm a covert narc, more likely vulnerable type, and for some strange reason, as I got into high school, I started becoming more and more paranoid of my own friends talking shit about me behind my back, and think that they are evil and out to get me, ruin my reputation, etc. They confronted me one time about it and I gaslighted the situation and said I was joking, I was basically implying and framing them in a group chat for operating in secrets against me, let's just say my friendship with them started to fall apart there. As years went on, I started distancing myself from them, and the thoughts of them spreading rumors about me, lying to others about me, and basically trying to make others hate me came to surface on my mind out of nowhere, EVEN though this probably is not the case at all, I thought about how they probably held a grudge for me after that conflict, and I also showed my vulnerabilities to them a lot, like they legit knew I was a very vulnerable person, they were supportive in the beginning, but somehow my mind tricked me into thinking they are the devil, although there were instances where people who I never met in school looked at me weirdly after knowing my name, so idk if that's my mind or legit. Anyone else suffering from this? I'm still trying to figure out if this is purely narcissism, it must be something else, a co-morbid, I always thought it was them that was causing trouble, but it in fact is me all along."
e8k95m,https://www.reddit.com/r/NPD/comments/e8k95m/i_think_im_a_narcissist_and_i_want_to_come_out/,"I think I'm a narcissist, and I want to come out.",14,5,1575944842.0,"My girlfriend just broke up with me. She was my first love and I feel empty inside.

After reflecting, I have come to the conclusion that the breakup was mostly due to my narcissism and selfishness. People have sometimes accused me of being narcissistic, but I always ignored them or laughed it off as a personality trait. I haven't been diagnosed with an official disorder, so I think I am more narcissist-resembling. I presume this is way easier to treat, but probably much harder to (self)diagnose because I am able to function normally in relationships for quite some time.

I was very selfish in my relationship. I would rarely think about how the things I said made her feel. When I said mean things, I would often just chalk it up to ""being completely honest, as you asked me to,"" when in fact I think I knew inside I was saying it to make myself feel better. I would sometimes make mean jokes at her behalf, or joke  about her failures.

Often, my behavior would lead her to become extremely sad and distressed. For example, one time I refused to set the alarm ten minutes earlier so she could have time for breakfast so that I could get my ""7 hours of sleep."" She started crying next to me in my bed. When she became extremely sad and distressed I would break down, and comfort her and hate myself for being so selfish. But sometimes I couldn't tell if I was actually angry at myself, or exaggerating to make her feel bad for me instead of herself.

I wanted to post this as a way to come out to people who have dealt with similar (but possibly much worse) narcissism. As of right now, I am confident that I will be able to be treated. I will be seeing a therapist. I am trying to think through everything I say, to think about whether it is mean, or hurtful, and whether I am saying it just for attention or to make myself feel better. Every selfish or narcissistic thing I say or do I write in a journal, where I write down ideas for how I could have avoided it.

I hope that in a few months' time, I will be able to enter a relationship and be confident in my ability to be caring, loving, and selfless. If this time comes, I will meet with my girlfriend and try to win her back. I am doing this both for myself and for her, but if she rejects me, I think I will be fine and able to move on.

She tells me to just move on and that she can never love me again. But our love was so deep that 'moving on' would feel like living a lie. I know that I could channel my cynical side to bury my emotions. I could dismiss her criticisms, and pretend like she will come back to me in no time (or at least miss me deeply). Or, I could hang out with friends, and just take my mind off and eventually forget the love and pain and just move on. But this feels disingenuous, and would require me to become a more shallow and less emotional person. Beyond that, I'm not sure how I could take love seriously after moving on from this relationship. It feels like it would require me minimizing the notion of love, since I would have to admit that the love in our relationship didn't mean enough for us to be successful.

Thank you for reading, and I look forward to joining this community, and to healing my broken mind and soul."
e8k6b8,https://www.reddit.com/r/NPD/comments/e8k6b8/i_dont_understand/,I don't understand.,2,5,1575944466.0,What's wrong with NPD? I don't see anything wrong with it. Why is it so wrong?
e8fq9c,https://www.reddit.com/r/NPD/comments/e8fq9c/anger_at_partners_health_crisis/,Anger at Partner's Health Crisis,13,7,1575924237.0,"First post, and thankful to be here.  I am openly NPD in recovery. I openly acknowledge who I am, and work through therapy and anything else I can to get better.  To manage it.  I am past thinking there is a cure. And it has worked, up to a point. Avoidance of alcohol and caffeine helps.  As does exercise and good sleep. I was making progress, thanks mostly to an understanding and committed partner. 

As ""successful"" as I have been managing the daily NPD struggle, I am making no progress when something big, serious happens. When stress and fear rise, my filters fail.

A few days ago, my partner had a seizure in my arms. It was my first experience, and I was terrified. But once she returned back to consciousness, and as my relief came and went, my emotion was anger at her. We had been discussing some relationship issues before it happened, but after, once she was back, I continued to harangue her. 

I am ashamed writing this. Instead of spending the day (and days to follow) caring for her, I expressed anger and frustration at stupid, plain vanilla relationship grievances.  

I needed to dip into the well of love and care for her.  And came up empty.  That's a terrible measure of a person.  

I don't want to be this way."
e8b48t,https://www.reddit.com/r/NPD/comments/e8b48t/opened_up_to_my_buddy_about_npd/,Opened up to my buddy about npd,9,16,1575904141.0,"He was pretty cool about it actually but then he told me he thinks I might be a sociopath LOL. Probably because he himself doesn't have much in the way of emotions, so I never show any around him. Just easier that way. Pretty sure I am not aspd tho. 

Has anyone else come out as a narc? I was stressing about it but it turned out all right for the most part."
e8avqk,https://www.reddit.com/r/NPD/comments/e8avqk/was_i_dealing_with_narcissistsam_i_the_narcissist/,Was I dealing with narcissists/am I the narcissist?,1,1,1575902981.0,[deleted]
e8238g,https://www.reddit.com/r/NPD/comments/e8238g/lost_a_friend_am_i_the_narcissist_confused/,Lost a friend: Am I the narcissist? Confused.,1,3,1575851178.0,[deleted]
e7s50f,https://www.reddit.com/r/NPD/comments/e7s50f/hatred_for_people_in_everyday_life/,Hatred for people in everyday life,18,3,1575799904.0,"I just realized that I’ve hated or disliked a lot of people throughout my life. Wanted to use them, or write them off as bad and acted toxic or hostile towards them. Now that I look back on it, I can’t rememver why I disliked people... but it usually was because I thought they were ugly, seemed fake, etc... 

But the reality was, I barely knew these people. I don’t know anything about them and yet I got so offended throughout my life that I never really got along with most people because I kept hating them. I always wondered when I’d finally meet “good people”, and make some friends, and then I realized that it’s me.. I’m the problem. Holy shit, I don’t even know what made me think like that. How the fuck did I write off like 80% of people throughout my life without really knowing them? 

Damn I think I act toxic to overcompensate for my lack of social skills. I feel awkward and uncomfortable around people, and my first reaction is to simply label them as bad and hate them. Wow...... I wonder if I have extreme social anxiety... idk, but I’m also not afraid to approach people if I need to use them for something"
e7l2kc,https://www.reddit.com/r/NPD/comments/e7l2kc/how_do_you_know_if_you_or_someone_else_is_a/,How do you know if you or someone else is a narcissist?,1,3,1575758071.0,[deleted]
e7g84u,https://www.reddit.com/r/NPD/comments/e7g84u/people_telling_me_im_a_narcissist_on_rnpd_its/,people telling me i’m a narcissist on r/NPD? it’s more likely than you think,13,20,1575735757.0,"on my more recent post i’ve been getting quite a bit of attention from narc abuse victims, specifically telling me that i’m a narcissist lmao. i just find it funny that i’m being called what i already know, especially on this subreddit. anyone else get these types of responses?"
e7cf5p,https://www.reddit.com/r/NPD/comments/e7cf5p/dae_hate_those_support_groups_that_look_like/,DAE hate those support groups that look like absolute jokes?,10,164,1575711293.0,"i’m talking like r/lifeafternarcissism r/narcissisticabuse and r/raisedbynarcissists specifically. they all take pleasure in putting us down and getting revenge while playing the victim the whole time, it really gets on my nerves. it seems like they act worse than we do at times. it’s just a bunch of complaining and venting to strangers and a lot of the times the person who hurt them wasn’t even a narcissist, yet they use the term interchangeably with abuser. it just makes me feel less sorry for them, not that i ever did. maybe they deserved it if they act this shitty to people. just had to rant, i’m feeling pretty annoyed about the issue.

EDIT: If you participate in any of those subreddits don’t comment, i’m not going to listen to what you have to say because you are biased, and this is not your community. do not derail."
e76wy1,https://www.reddit.com/r/NPD/comments/e76wy1/faking_being_someone_else/,Faking being someone else,5,2,1575677420.0,"Hi. I was intrigued by someone saying they're a psychiatrist around here. I was wondering did you guys ever faked or lied about your profession or what you do?

In my case, I say on Disqus I'm an expert in geopolitics and work for a ""world class think tank"". Naturally none of that is true."
e6k565,https://www.reddit.com/r/NPD/comments/e6k565/is_your_family_narcissistic_too/,Is your family narcissistic too?,6,4,1575565745.0,"Mine is super narcissistic although nobody but me has been diagnosed. I actually noticed their narcissism waaaaay before I caught on to my own. My parents are sorta benign but my extended fam is whacko and borderline evil at times. 

I really hate my family and apparently I am just like them, fuckin great... /s"
